Publication Date	Time	Publisher	Author	Title	URL	Text
2020-09-14	17:56:38Z	Cherwell Online		Opinion - veganism is not yet fully accessible	https://cherwell.org/2020/09/14/opinion-veganism-is-not-yet-fully-accessible/	Lucy Betts asks why veganism may still be considered a luxury lifestyle, and explores the ways it remains inaccessible for some. What do you envision when you think of a vegan? Do any specific words come to mind? I’ll throw out a few, feel free to disagree: “hipster”, “activist”, “hippy”, “middle class”…”annoying”. This image is out there, publicised, non-controversial and acceptable to routinely spout on TV. Like all groups who attempt to break away from anything previously considered to be social norms, vegans are villainised. They are vigilantes holding ideologies which lie far left of society’s interests but will, ultimately, one day vote Tory. An unbearably high maintenance lifestyle (centring on health, cleansing, spirituality and animal welfare) is the illusion a great deal of people are under. This is problematic, not only for the image of the movement, but for the ecocide environmentalists are desperately attempting to prevent. Creating an aura of exclusivity around a philosophy which can, realistically, only be elevated above the status of a social statement to become genuinely impactful with mass participation, is entirely counter intuitive. Exclusivity is generated through selectively broadcasting a specific image and consumer choice driving faster deployment of more expensive products. Despite this portrayal, veganism is on the rise, with the Vegan Society’s latest research indicating around 600,000 vegans reside in Great Britain. In light of this, a critical question is then brought to the forefront: what makes someone more susceptible to veganism? As with all things remotely political, social class and wealth are inextricably tied in. Citizens of the UK are under the illusion that food security has been achieved. In turn, this indignance to greed and overconsumption threatens a vengeful insecurity. Malnutrition is something that is ignored. The general public have not been galvanised by the Environmental Audit Committee’s latest report, which states that undernourishment is “significant and growing in the UK, with levels among the worst in Europe, especially for children”. Shockingly, in a nation viewed as distinctly developed, people’s diets remain depauperate and their nutrition poor. Members of the general public send their children to school on empty stomachs and ideologies clash amongst the politically inclined who argue for reform. These issues are entirely distinct from those surrounding diet choice; they are issues of food insecurity where individuals are stripped of all choice. They should not be confounded with a reluctance to adopt veganism. There is little ground to stand on when insisting that persistent low income (estimated to be approximately 22% of the UK population) prevents a significant chunk of the public from turning their backs on beef. Only 1.6% of the population identify as vegan. Do the remaining 80% of people considered to be financially stable also feel tofu to be an unjustifiably expensive commodity? Whilst the average middle class shopper might be able to nip into their local Waitrose, it’s a different story for the shopper living in a low income area with 3 hungry (fussy) kids to feed on a budget. Picking up an overpriced vegan ready meal on a busy night is out of the question. Yes, it’s achievable to go vegan on a budget, but people want convenience. They have lives to contend with, personal endeavours to pursue, personal tastes which have already developed. At the end of the day, most people prefer to be left alone to enjoy their 99p cheeseburger in peace and quiet. Planning for a week of vegan meals requires forethought, knowing how to cook in a way your mother or father didn’t (or knowing how to cook at all), adapting your tastes and exiting your comfort zone. As a student this is relatively simple; as a household with a mish-mash of diet preferences, it’s most certainly not. Removing a class divide from a vegan ideology would entail better marketing of vegan options in popular food outlets beyond Holland and Barrett. It would require lower prices of non-threatening vegan foods which don’t take hours to cook and actually taste good (sorry Tesco, your ‘cheese’ is disgusting). Ideally, this would be supplemented by effective education surrounding the food system and the importance of sustainability. I don’t contest that certain groups need to try a whole lot harder than others to cut out meat. I do contest that this is the major driving force preventing radical diet shifts. Paying £2.50 for a pack of Tesco Plant chef Breaded Goujons can really add up when you normally pay only £2.00 for their plain old chicken ones. £2.00 for a kg of lentils on the other hand could make more than enough Dahl to feed a family. At its core, the reluctance to support veganism is rooted in something far more universally entrenched than finances. When delving into the depths of vegan culture, it’s important to assess where the motives for such a radical diet change might stem from. People live in their own bubbles of like-minded companions which are far less accessible than they might like to think. Research conducted by Ofcom concludes that social media users today are less likely than in 2016 to see views they disagree with online. Those who begin to pay attention to where their food comes from, how it’s made and the environmental impacts of its production are likely to find themselves on a downward spiral deep into the depths of YouTube documentaries. This is a fairly niche topic of interest to jump into out of the blue. Even more so when your top video suggestions are ‘Ryan’s Toys Reviews’ and your traditional British family life revolves around a Sunday roast. Being influenced by your social and cultural environment is part of being human. Perhaps, then, it’s not shocking to hear that several studies have resolved that “across Western societies, women are twice as likely as men to be vegan or vegetarian”. Considering the marked prevalence of admired female celebrities who publicly adopt a vegan diet (Ariana Grande, Miley Cyrus and Ellen DeGeneres to name a few), this is a given. It’s hard to be taken seriously in your prolific cult of masculinity trading up a bacon sandwich for hummus and crudites (especially whilst Dwayne ‘The Rock’ Johnson endorses chowing down on a dozen eggs a day). Clearly veganism appeals to a specific demographic. It seems they are in a deadlock, the herbivores and omnivores. They have found themselves in a political war waged through publicity stunts and protesting, supplemented with a healthy dose of social network sparring. Mass media has managed to sculpt a particular perception of veganism, zoning in on a snapshot of the culture. This snapshot captures a minority self-righteous cult of entitled ‘snowflakes’ who like to purchase expensive sustainable fashion on daddy’s credit card. Vegans, instinctively, have sought to fight back. With the popularization of Greta Thunberg, organisations such as Extinction Rebellion being thrust into the limelight and the general growing discomfort surrounding the idea of a climate crisis, the frost towards veganism is starting to thaw. Alongside this thawing, inaccessible logic trapped within the ice has begun leaking out. This logic is making its way gradually into the theatre of fast-food outlets which are now being forced to play ball. Though perhaps not the best way to conserve biodiversity (considering simultaneous attempts to battle an obesity epidemic), it does alleviate issues associated with food accessibility for vegans. As KFC and McDonald’s pioneer in accessible vegan junk food, Greggs flaunt their instantaneously infamous vegan sausage roll. Though responses have been overwhelmingly positive, these new product lines have proven divisive. With one subtle menu addition, the ‘vegan resistance’ was stubbornly declared by Piers Morgan in a tweet against those ‘PC ravaged clowns’ at Greggs. If vegans are not being publicly thwarted, they’re being passive-aggressively ‘integrated’ into society in the most patronizing of ways. Even at the hands of the more ‘nonpartisan’ BBC, the movement is belittled. Vegans are made into caricatures to be humoured in good faith. ‘The Food Chain’ podcast’s newest release “how to date a vegan” has attempted to render abstaining from animal produce devoid of all deeper meaning, presenting vegans as nothing more than fussy eaters. I greatly anticipate their upcoming release, “how to date a feminist”. Continually, society fails to recognise that justifications for going vegan extend far beyond the traditional “meat is murder!” sentiment. Personally, I actively contest this emotional aspect; humanity’s critical downfall in many endeavours is an inability to distinguish between routes which are both moral yet pragmatic, and routes which are selfish but satisfying. This is perhaps why the legal system favours revenge over reform or why Starbucks doesn’t really pay its taxes and no one cares. Veganism being inaccessible boils down to a culmination of misinformation, comfort in conformity and personal problems more immediate than the more ultimate problems the planet faces. Though a share of these problems are indisputably financial, deciding that you aren’t going to participate in institutionalised abuse and environmental destruction is not as simple as a random change of heart. People make it pretty damn difficult. You need to make a concerted effort to get informed. You need to know what you believe and have the strength to stand by it. This takes effort, motivation and a willingness to care. Pivotally, it also takes a collection of like-minded peers, some healthy debate and exposure to certain forms of media beyond your Facebook feed and daytime TV.
2020-09-02	07:00:00Z	Plant Based News	Maria Chiorando	Top 10 Countries Where Veganism Is Most Popular Revealed By New Research	https://www.plantbasednews.org/lifestyle/top-10-countries-veganism-most-popular	Switzerland was number 8 on the list (Photo: Adobe. Do not use without permission) The top 10 countries where veganism is most popular have been revealed in a new list. Chef's Pencil compiled the list by analyzing Google Trends data, which it describes as a 'reliable source of big data', to search interest level for veganism across the world. It found that searches in the veganism category (including vegan-related searches made in any language) were at an all-time high in 2020. In a statement sent to Plant Based News, Chef's Pencil revealed that the COVID-19 pandemic has not stopped the rise of veganism but has 'added fuel to its popularity'. The organization added that searches for vegan recipes have skyrocketed, and continue to go strong - even though lockdown has come to an end in most parts of the world and many restaurants have re-opened. Search data showed that countries whose cuisine traditionally is greatly meat- and dairy-based are seeing a big rise in veganism, said Chef's Pencil, which it concluded means that 'veganism is stronger than ever'. 1. United Kingdom (Popularity Score: 100) 2. Australia (Popularity Score: 87) 3. Israel (Popularity Score: 84) 4. Austria (Popularity Score: 82) 5. New Zealand (Popularity Score: 81) 6. Germany (Popularity Score: 77) 7. Sweden (Popularity Score: 68) 8. Switzerland (Popularity Score: 65) 9. Canada (Popularity Score: 64) 10. Ireland (Popularity Score: 63) Maria is the editor of Plant Based News. Her work has been published by The Guardian, The Huffington Post, and various regional newspapers, as well as Vegan Life magazine. 
2020-09-10	07:00:00Z	Daily Trojan Online	MONTANA DENTON	Triple Bottom Line: The meat of the matter	https://dailytrojan.com/2020/09/10/triple-bottom-line-the-meat-of-the-matter/	It’s the second installment of my column and time to jump right into the controversial stuff. It’s time to broach a highly debated, heavily memed subject: veganism. Full disclaimer — I am not and have never been vegan. Throughout college, I’ve gone through phases of experimental vegetarianism, but even when my lactose-intolerant brain screams “no,” I see no reason to turn down a good grilled cheese or a slice of pizza. While my admittedly short, albeit dedicated vegetarian experience is over (for now), my eating habits have definitely changed. I find myself naturally gravitating toward more plant-based foods instead of meat-heavy meals. A few years ago, I would never have believed that a veggie California burrito just hits different than the classic carne asada (pro tip –– it absolutely does). While vegetarianism and veganism are growing in popularity, being a conscientious grocery consumer is a privilege, not a right. While society is more accommodating of dietary restrictions than ever, it can still be costly to maintain a balanced and nutritious vegan diet. Many advocates of veganism claim that staples such as pasta, rice, tofu, beans and lentils are cheaper than their animal-product counterparts. You’ll undoubtedly save money not buying meat –– it’s estimated that one fillet of chicken breast is $5 per pound and has about 24 grams of protein per serving, but a can of black beans typically costs around a dollar for the same amount of protein. The math is simple –– per year, plant-based consumers can save a significant amount of money. However, vegan diets do require dedication. Buying more fresh produce is great for your body, but comparatively, it goes bad much faster than frozen foods or pantry sundries, meaning more quick trips to the grocery store are needed to restock. Many vegans also develop nutritional deficiencies because they commonly lack vitamin B12 and vitamin D3, nutrients that are found almost exclusively in animal-sourced foods and are crucial for nerve and brain function. While being vegan can be affordable, this doesn’t offset the fact that some degree of budgetary flexibility is needed to successfully maintain a plant-based diet. It is achievable, but not for all. Kids who are part of school-free and reduced-lunch programs don’t have the luxury of rejecting what is put on their plate. In food deserts like South Central, it can be more difficult (although not impossible) to access a consistent assortment of fresh produce. Getting the most food for your dollar means that many aren’t necessarily focused on the nutritional quality of what they’re purchasing –– they’re just trying to make sure their family doesn’t go hungry. Processed foods often have a longer shelf life and are more readily available than fresh fruits, vegetables and pricey vegan-certified and meat-substitute products. For those that qualify for the United States Supplemental Nutrition Assistance Program, it can be extremely hard to align the goals of both healthy and affordable eating. The federal program, often referred to as SNAP, is essentially a food-stamp benefit program designed to “supplement the food budget of needy families so they can purchase healthy food.” While its goal is admirable, it’s also extremely vague. There is an educational component of the program that teaches SNAP beneficiaries about the best methods of buying cheap, nutritious foods and leading healthy lives. However, the number of stores that accept SNAP is limited, and beneficiaries are more focused on their primary goal of alleviating hunger than choosing the most nutritious options. Additionally, the maximum monthly SNAP allotment for a family of four is $649, coming out to $36 a person per week, leaving little room for error or experimentation when shopping for the bare essentials. Many ways to improve the program and enhance its nutritional impact have been suggested, including increasing the number of places that accept SNAP benefits, expanding to more farmers markets and offering cash incentives to purchase and further subsidize the cost of fresh produce. To fully commit to and execute their goal of achieving healthy lifestyles for all, the process of food accessibility as a whole needs to change. No one sells the vegan lifestyle like a newly converted vegan. There’s no shortage of celebrities, professional athletes and influencers who are strong proponents of a plant-based diet. Colorful photos of carefully prepared fruits, veggies and grains flood Instagram health accounts, reinforcing the message that veganism is healthy, easy and enjoyable. While these fit, glowing and healthy individuals make veganism look fun and simple, it’s important to consider the divide between Instagram and reality. Even for the everyday herbivore, dedication, time and research are needed to ensure you are getting all of the supplements and nutrients needed for a healthy diet. A few years ago, LeBron James made headlines for following an extremely strict paleo diet –– cutting out sugar, carbs and dairy entirely and subsisting solely on meat, fish, fruits and vegetables –– and losing a drastic amount of weight. The reason LeBron was so successful? He had resources that the average health-conscious consumer does not — private trainers, nutritionists and chefs to provide him with the knowledge and nutrients needed to conduct a drastic diet change and still maintain his superhuman fitness and athleticism. In most instances, it can be extremely unhealthy and unsafe to cut entire food groups out of your diet. Those with underlying health issues, allergies and dietary restrictions and those recovering from eating disorders may not necessarily benefit from a restrictive diet like veganism. All this is not to say that being vegan can’t be a healthy, family-friendly diet, but there are several crucial caveats to consider when contemplating a switch to veganism. Having the ability to make choices about what you eat is a privilege in itself. Veganism can be an affordable, eco-friendly and ethical switch –– if you have the resources to do so. Montana Denton is a junior writing about environmental issues, sustainability and society. Her column, “Triple Bottom Line,” runs every other Thursday.
2020-09-03	07:00:00Z	Green Queen Media		Revealed: The 5 Biggest Misconceptions About Veganism	https://www.greenqueen.com.hk/revealed-the-5-biggest-misconceptions-about-veganism/	
2020-09-14	23:51:02Z	New Zealand Herald	NZ Herald        Share via email  Share on Facebook  Share on Twitter  Show more  Bookmark this article     Share on Facebook facebook    Share on Twitter twitter    Share via email email    Share on LinkedIn linkedin    Share on Google Plus google-plus    Share on Whatsapp whatsapp    Share on Pinterest pinterest    Share on Reddit reddit	New Zealand ranks fifth in the world for veganism	https://www.nzherald.co.nz/lifestyle/news/article.cfm?c_id=6&objectid=12364765	
2020-09-12	04:00:00Z	USA Today 10Best		Oysters are okay to eat for some vegans – here's why	https://www.10best.com/interests/food-culture/why-vegans-eat-oysters/	
2020-09-03	18:28:18Z	The Beet	smcclain	Miley Cyrus, Formerly Vegan, Admits She Now Eats Fish	https://thebeet.com/miley-cyrus-formerly-vegan-admits-she-now-eats-fish/	In a recent interview with podcaster Joe Rogan, Miley Cyrus revealed that she has officially forsaken the title of vegan, and in 2019 added fish to her diet, and now considers herself pescetarian. An article today on Plant-Based News took a deep dive into the podcast episode that Rogan hosted with the superstar, who said that she ditched veganism after it impeded her brain function. ‘I was vegan for a very long time and I’ve had to introduce fish and omegas into my life because my brain wasn’t functioning properly,’ Cyrus remarked, referring to Omega-3's which are present in fish but can also be found in vegan foods like walnuts, edamame, soybean oil, kidney beans and seeds like chia, hemp and flax. Cyrus was reintroduced to fish after her ex-husband Liam Hemsworth, another former vegan, barbequed her some on their grill in 2019. "Now I’m so much sharper than I was and I think that I was at one point pretty malnutrition," says Cyrus, who is known as an outspoken advocate for animals. After Rogan warned that her vegan fans were going to be upset, the 27-year-old defended her new diet, saying, "Listen, I give home, I have 22 animals on my farm in Nashville, I've got 22 in my house in Calabasas like I'm doing what I need to do for the animals, okay? But when it comes to my brain - you're not vegan, you can't be vegan and living this kind and being this quick, but sure you can, some people can, I cannot." Scientific evidence seems to refute Cyrus' claims of improved brain function after ditching a vegan diet. A study that followed nearly one thousand participants for five years assessing their brain function and concluded that a diet heaviest in leafy greens was most brain-healthy. A vegan diet rich in whole foods would fit the bill. Dr. Matthew Nagra, ND, took to Instagram to comment on Cyrus' recent transition back into eating some animal product, suggesting that a placebo effect may have caused the star to feel improved cognitive function, "Something that should give pause is when someone notices drastic improvements with a small dietary change. This screams placebo effect. On a physiological level, it’s impossible for a few meals of seafood to drastically change omega-3 levels, especially within the brain." "This becomes even more likely when a vegan has constantly been told that their diet is deficient by those who clearly have not seen the data. We can start to believe it…That being said, we have no clue what Miley was actually eating." What do you think about Cyrus' recent departure from veganism? Let us know in the comments below. 
2020-09-09	11:05:25Z	Plant Based News	Louisa Kendal at Viva!	As Stars Ditch Veganism - Does Celebrity Culture Hinder The Vegan Movement?	https://www.plantbasednews.org/opinion/celebrity-culture-hinder-vegan-movement	Does celebrity culture hurt the vegan movement? Miley Cyrus is the latest celebrity to step down from the vegan movement. According to Cyrus, she had to incorporate fish into her diet because her brain wasn’t functioning properly. Well, she is half right. If she wasn’t getting her omega 3s through either algae supplements (where the fish themselves get it from) or a balanced vegan diet, her brain health would have been suffering. But, it takes just a few minutes of googling to find out that an algae oil supplement or regular intake of certain nuts and seeds (especially walnuts and flaxseeds) would have provided her with far healthier sources of omega 3 than fish. Since Cyrus’ announcement, my social media feed has been full of vegans expressing their disappointment in such a high profile vegan giving up. The tabloids have been jumping on the bandwagon with snarky comments about malnutrition, and even my friendship group (where vegans are very much the minority) are discussing how it was bound to happen if you ‘restrict your diet so much.’ And this right here is the problem. The spotlight has turned away from the victims - the animals trapped in horrific farms before they’re shipped off to a brutal death - to one extremely privileged person who couldn’t be bothered to do their research. 'It’s time we stop glorifying those that stand in the spotlight and focus on those trapped in the dark, barren sheds instead' Committed animal advocates have continued to stand on high streets showing people factory farm footage, having difficult conversations, educating their friends and family on vegan alternatives and fighting for a better world. But thanks to our toxic attitude towards celebrities, Cyrus’s decision to eat fish is the story that’s stolen the headlines. Society is slowly moving closer to understanding that eating animals is inherently wrong, but all that work is undone when we allow ourselves to put people on pedestals and take their word as gospel. The vegan movement is about ending animal oppression. But when we allow some humans to have more importance than others, how can we ever expect people to value human and non-human animals equally? Celebrities sell their lifestyle as their brand, but veganism is so much more than this. It’s time we stop glorifying those that stand in the spotlight and focus on those trapped in the dark, barren sheds instead. This article was originally published by Viva!. Louisa is the digital communications officer at leading animal protection charity Viva!. She has been vegan for four years and is passionate about eradicating injustices and exploitation in our world.
