Publication Date	Time	Publisher	Author	Title	URL	Text
2020-08-26	07:00:00Z	Plant Based News	Maria Chiorando	1 In 20 Adults Think Vegans Eat Meat, Says Poll	https://www.plantbasednews.org/lifestyle/-1-in-20-adults-think-vegans-eat-meat	A poll uncovered some of the common misconceptions around veganism (Photo: Adobe. Do not use without permission) One in 20 people believe 'vegans can eat meat', according to a new poll. 3,739 non-vegans around the world were surveyed by ChewsyGum.com, which wanted to uncover some common misconceptions. While one in 20 believe vegans can eat meat, 16 percent think they eat cheese, and one percent think they cannot eat bananas. George Driscoll, vegan and owner of sustainable travel Instagram account @immyandgeorge, spoke to ChewsyGum about the survey results. He said he would rather a few people get the wrong idea of veganism and do it imperfectly, than one person turns entirely vegan. He added that while some people think 'veganism is lavish and expensive', there are many cheap and easy plant-based meals, like beans on toast or lentil dhal. Driscoll revealed that he used to laugh at vegans himself, but after giving up all animal products himself he has 'never felt happier', and cares a lot about animals and the planet. He concluded that he wishes people would ask more questions about veganism - and follow them up to find out the answers and 'make informed choices'. Maria is the editor of Plant Based News. Her work has been published by The Guardian, The Huffington Post, and various regional newspapers, as well as Vegan Life magazine. 
2020-08-24	07:00:00Z	Times of India		7 dangerous side effects of Vegan diet	https://timesofindia.indiatimes.com/life-style/food-news/7-dangerous-side-effects-of-vegan-diet/photostory/77717097.cms	
2020-09-14	14:15:13Z	South China Morning Post	DPA	Sustainable and aware: the new content from social media stars	https://www.scmp.com/lifestyle/entertainment/article/3101435/influencers-pivot-promoting-products-championing-ideas-such	Published: 10:15pm, 14 Sep, 2020 Updated: 11:23pm, 14 Sep, 2020
2020-09-15	17:20:36Z	Mic	By Melissa Pandika	Meet Genesis Butler, the 13-year-old activist with a plan to save the earth	https://www.mic.com/p/meet-genesis-butler-the-13-year-old-activist-with-a-plan-to-save-the-earth-34000992	While much of the country took up tie-dye and bread baking when the pandemic hit, 13-year-old Genesis Butler launched a global youth movement to discuss the impacts of animal agriculture on climate change. Now, Youth Climate Save boasts more than 70 chapters in places as far away as India and the U.K. Its members hold weekly Zoom meetings to plan fundraising and other actions youth can take online, as well as an upcoming vegan support group. A sense of urgency animates Butler, who cites research on how a shift to veganism can fight climate change. âThatâs basically what Iâve been focusing on, just talking about how if we donât start going vegan, weâre not going to have a planet,â she says with sobering, wide-eyed earnestness. Butler speaks with Mic over Zoom from her momâs house in Long Beach, California. When she excuses herself mid-conversation to tell her younger siblings to be quiet, earbuds in her ears, she seems like any other teen, but she conveys conviction far beyond her years. Besides Youth Climate Save, the vegan activist founded Genesis for Animals, a nonprofit that helps fund animal sanctuaries, when she was only 11. By speaking out against the mass production of animals, she seeks to create a world where all creatures can thrive. More broadly, her work reflects Gen Zâs collective anxiety over the very real possibility that the most devastating effects of climate change could unfold in their lifetime. Worldwide, 70% of people are reducing their meat consumption or spurning meat altogether, according to a report by learning and data analytics company GlobalData, referenced by Forbes. Many cite health reasons for following a plant-based diet, as well as concerns about the inhumane conditions at factory farms, responsible for 90% of the global meat supply, per the Sentience Institute. Then there are all the environmental impacts of animal agriculture, including greenhouse gas emissions, the clearing of forests for grazing and growing feed crops, and the pollution of communities of color. Factory farms may even birth the next pandemic, Vox reports. Butler became a vegetarian at age three, when she asked her mom where chicken nuggets came from. Initially, her mom responded that they came from the grocery store. Unsatisfied, Butler pressed her mom until she explained that chickens needed to be killed to produce them. âI was devastated,â she recalls. She forayed into veganism three years later, after she saw her mother nursing her younger sister, which made her wonder about the origins of the milk she drank. Her mom explained that it came from mother cows, which Butler then compared to people taking her momâs milk to give to people other than her baby sister. âI never thought of it that way,â her mom told her. Butler went vegan, and her parents and three younger siblings followed suit. The six-year-old had reached a crossroads, though. Gymnastics consumed all her time, especially now that sheâd started training for the Junior Olympics. But activism called her. Eventually, she gave up gymnastics to focus on activism. The response to the TEDx talk she gave at age 10, urging people to consider the environmental impacts of meat consumption, affirmed her choice. She began gaining a following, receiving invitations to speak âall over the place,â she says. âI thought, âThis is what Iâm here for.ââ That realization took time, though, especially for someone who considers herself âvery introverted,â but sheâs learned to adapt. And activism runs in her blood: CÃ©sar ChÃ vez is her great grand-uncle. Learning about how he continued protesting, even when people threatened to call the cops on him, inspired her. âIt just influenced me to be brave and not really care what people think.â After Butler went vegan at age six, she started visiting animal sanctuaries, which offer refuge for animals who canât survive in the wild. Her favorite is New Life Animal Sanctuary in Lake Elsinore, California, where the animals are rescued from labs and slaughterhouses. âThe animals are so trusting and sweet, even after everything theyâve been through.â Two years ago, after talking to owners about the staggering financial costs of running a sanctuary, Butler started Genesis for Animals to raise funds for animal care at sanctuaries, including food, shelter, and veterinarian visits. She donates the money she earns from speaking events, and a link on her nonprofitâs website allows others to make tax-deductible donations. âItâs mainly just me,â she says of Genesis for Animals. âMy parents will help me if I have any questions.â She tells Mic that her ultimate goal for her nonprofit is to keep fundraising so sanctuaries can continue taking in animals, especially as more slaughterhouses shut down due to coronavirus outbreaks. Many argue that closing slaughterhouses leaves droves of animals with nowhere to go, but Butler believes this ignores a larger problem: the mass production of animals. âIf theyâre not mass produced anymore, then we wouldnât have as many as we have right now,â she says. To tackle this deeply entrenched practice, Butler discourages people from buying meat. âPeople are voting with their money, so when youâre buying meat, youâre basically saying itâs ok to kill animals,â she explains. She owes the recent proliferation of vegan meats and other products to consumers increasingly saying âyesâ to them. To justify their meat purchases, some people say â'Itâs humane, itâs grass-fed,'" she explains. But âthereâs no such thing as humane meat. You canât kill animals and say it was ok, because no animal wants to be killed.â Butler has seen a glimpse of what animals experience in their final moments while attending pig vigils outside the Farmer John slaughterhouse in Vernon, California, where activists greet trucks loaded with pigs before their death. âWhen you look at their eyes, theyâre really scared,â she says. Friends sheâs taken to pig vigils have since stopped eating meat. âIf you saw these animals before they died, you wouldnât eat them anymore.â To Butler, animal welfare isn't that complicated. "I think animal welfare is just being fair to animals and treating them how we want ourselves to be treated. And its importance resides in what we share with them: certain physical features, personalities, emotions. They just want to be loved like me and you," she says. "We don't give them credit for what they have to go through." Recently, Butler was immortalized as a vegan superhero on Disney +âs Marvel Hero Project, an animated series featuring young change makers. âThey gave me my own episode,â she says. âThat was also really cool since I am a person of color.â She believes itâs important for other young BIPOC to see her engaged in this work, since it can inspire them to do the same. âI think veganism is thought of as a white thing or thing for hippies to do, but itâs not,â she says, pointing to her own indigenous, Black, and Mexican ancestry. âThere are people of all races and backgrounds who are vegan.â These days, Butler has been busy with online high school classes, cleaning her room, and responding to Instagram comments, story replies, and DMs, often from people seeking advice on shifting to veganism. One of Youth Climate Saveâs projects is to create a support group for youth who want to go vegan and/or get their families to do so, which will include tips, recipes, and other resources, and launch sometime this month, she tells Mic. Indeed, Gen Z appears to be embracing the plant-based lifestyle more than previous generations. âI think this generation is talking about veganism now because itâs the easiest thing we can do about climate change,â Butlerâs explains. âAdults are talking about [veganism] a little bit, but not as much as they should, so youth are stepping up and doing it.â Her words carry the weight of an existential crisis that teenagers like Butler shouldnât have to grapple with, the result of systems established long before they were even born. When asked where she sees herself in five years, she responds that sheâll be in high school; sheâs unsure about attending college, since she already knows she wants to run an animal sanctuary. She also hopes that by then, all animals can live freely, and more of us will start going vegan. After all, she notes, five years is a long time â a comment that might make us old-timers smile, until you remember it accounts for nearly half of Butlerâs life, and that the weâre seeing the devastating impacts of climate change right now. With an unsettling matter-of-factness, she describes the sunâs deep red hue and the ash falling from the sky where she lives, due to the blazes engulfing the West Coast, whose unprecedented scale experts have attributed to climate change. âWeâre running out of time,â she says. âIâm trying to do something about it now before itâs too late.â
2020-09-16	06:11:26Z	The Jerusalem Post		Shocking 'Fresh, Fresh' commercial promotes vegan diet in Israel	https://www.jpost.com/israel-news/shocking-fresh-fresh-commercial-promotes-vegan-diet-in-israel-642449	
2020-09-01	07:00:00Z	Green Matters	sophie	Why Vegans Don't Wear Silk	https://www.greenmatters.com/p/why-dont-vegans-wear-silk	Silk is often touted as an eco-friendly, natural, material — but with so many fabrics out there, it can be hard to determine what is really sustainable, and what simply has gotten a sustainable reputation. Questions about the sustainability of silk may have you wondering why silk is not considered a vegan fabric — because if going vegan is one of the most impactful lifestyle changes we can make for the planet, why don’t vegans wear silk? Read on to learn more about why vegans do not purchase silk, how silk is made, and whether or not silk is as eco-friendly as it may seem. Vegans don’t eat, wear, or use products made from or by animals, instead opting for animal-free and cruelty-free food, clothing, and products. Silk is made from fibers spun by worms, who are animals, in a process that’s surprisingly cruel and typically ends with the worms being killed. For those reasons, vegans typically do not wear or use silk. Silk is a fabric made from the fibers that silkworms spin when they are building their cocoons. Most silk is made from domesticated silkworms that are raised on farms, just like how meat and dairy come from animals bred and raised on farms. There are a few different processes when it comes to taking silk from worms, but here’s one of the most common processes for how worms commercially make silk, as explained by ThoughtCo. After being bred, the silkworms are fed mulberry leaves (hence the name “mulberry” silk). Once they are ready to spin their cocoons, they enter the pupal stage. At that point, they secrete a liquid version of silk from two glands in their heads, and form their cocoons. In nature, the worms would eventually chew through their cocoon, emerge as a moth, and fly away. However, in the silk industry, this is the point where farmers drop the cocoons, which contain the live silkworms, in boiling water. This not only kills the worms, but also unravels the cocoons, resulting in the formation of long silk threads. Unfortunately, this process has a very low fabric yield. According to PETA, around 3,000 silkworms are killed to make just one pound of silk. Or, as ThoughtCo puts it, for just one gram of silk thread, 15 silkworms are killed; and for one silk sari, 10,000 are killed. UK's @StellaMcCartney is an advocate for #WomenEmpowerment. She created gown using 🇮🇳 Oshadi’s peace silk & wove perfect story of #IndiaUK #UnbeatableCombination at @Commonwealth18 #FashionIsGREAT @AntoniaRomeoUK @smritiirani @TexMinIndia @GCC_ECOAGE pic.twitter.com/OHyfoM63i2 Peace Silk, also known as Ahimsa Silk (ahimsa is Sanskrit for non-violence), is a process of harvesting silk from worms without killing them, according to Treehugger. Stella McCartney is famously a vegetarian fashion house, eschewing animal-based leather and fur, but she does use silk — primarily, commercial silk, but occasionally, Peace Silk. As explained on the luxury designer’s website, Peace Silk is made the same way as commercial silk; the key difference is that the farmers allow the silkworms to naturally emerge from their cocoons as moths, and then fly away. At that point, the farmers gather the silk from the abandoned cocoons. However, revamping the silk industry is not as simple as everyone switching to Peace Silk. For one thing, this method produces broken silk thread, as opposed to the long silk threads that are created by the worms in the commercial silk industry. The threads then need to be woven together, Stella McCartney explains. Because of that, Peace Silk is more expensive than commercial silk. Not only that, but the process is still not one most vegans would condone, as it still involves the breeding and use of silkworms. Additionally, the worms used in the silk industry have been bred over centuries to be optimal for producing silk (much like chickens, cows, pigs, and other animals in the factory farming system), so even though they are “set free” once they become moths, they can only survive for five to 10 days after leaving their cocoons, according to mueZart. Some vegans are comfortable purchasing and wearing clothing made from secondhand silk, as doing so takes the item out of the waste stream, and does not contribute to the demand for more silk. But fortunately, if you do not want to wear silk, there are many alternatives. Silky fabric alternatives are often made from semi-natural, semi-synthetic fabrics such as viscose, rayon, lyocell (aka TENCEL), and modal. These fabrics are all semi-synthetic cellulosic materials, according to the blog Ecocult, and in many cases, are biodegradable, and sometimes even compostable. Other silk fabric alternatives can be made with synthetic fibers, most commonly polyester. Of course, polyester is generally not seen as eco-friendly, as it is made from petroleum. But because synthetic fabrics do not involve any animal exploitation, vegans are likely to choose polyester over silk — but a great middle ground choice is a garment made from viscose, rayon, lyocell, or modal. Silk is most commonly used to make clothing including neckties, blouses, wedding dresses and evening gowns, and lingerie; it’s also sometimes used to make household items like silk pillowcases and dental floss. Fortunately, there are vegan versions of all these items — and not only will they be free of animal cruelty, but synthetic and semi-synthetic fabrics are typically cheaper than natural silk. Click here for a list of brands using vegan silk. According to the Sustainable Apparel Coalition’s Higg Index, and as reported by Ecocult, “silk has by far the worst impact on the environment of any textile, including polyester, viscose/rayon, and lyocell. It’s worse than the much-demonized cotton, using more fresh water, causing more water pollution, and emitting more greenhouse gases.” Even though silk is biodegradable, the process of harvesting silk has a very high environmental impact — mostly in terms of energy use, but also in terms of chemical use (some silk farms use formaldehyde, chlorine, and other toxic chemicals), fresh water use, water pollution, and greenhouse gas emissions. In fact, silk contributes to those latter three factors even more than cotton does. Surprisingly, the Higg Index found polyester to be the lowest-impact alternative to silk — even lower impact than the semi-natural fabrics listed above. 100 percent silk fabric will break down in your compost pile — but it will take longer than the average banana peel to break down. According to various sources, it could take up to a year to completely return to the earth. That said, before chucking an old silk blouse in the compost bin, investigate the material of your silk garment’s surrounding fabric, as it could be layered with a synthetic lining, or sewn together with synthetic thread. According to the blog Can I Compost This?, makers of garments with natural fibers sometimes get away with using polyester-based thread, which will not break down in the compost. So if you don’t mind plucking the thread out of your compost heap after the garment has disappeared, go for it. Just don’t put it in a compost bin that you do not monitor (such as your municipality’s curbside compost service), since the thread could contaminate the batch. Additionally, silk dental floss is compostable, and it generally breaks down in backyard compost bins in 6 to 10 months, according to the brand Dental Lace. And good news for those who avoid the use of silk — the brand also makes a plant-based floss that is compostable.
2020-09-15	13:08:32Z	Healthline	Alina Petre, MS, RD (NL)	Incomplete Protein: Is It a Concern?	https://www.healthline.com/nutrition/incomplete-protein	Plant-based sources of protein are often deemed inferior to animal-based ones, as the former is said to contain “incomplete” proteins. This causes many to fear they may be getting the wrong type or quantity of protein when following a vegetarian or vegan diet. However, there are many reasons why this belief should be considered more of a myth than a reality. This article discusses the difference between “complete” and “incomplete” proteins, as well as why vegetarians and vegans have little reason to fear getting too little of the former and too much of the latter. Protein is made up of building blocks called amino acids. Although hundreds of amino acids exist in nature, only 20 are needed to make all of the protein found in your body. These can be split into three main categories (1): Foods that contain good amounts of all nine essential amino acids are generally considered sources of “complete” protein, whereas those that don’t are labeled as “incomplete” protein. Protein is made from amino acids, which can be categorized as essential, non-essential, or conditionally essential. Protein-rich foods are typically categorized as “complete” or “incomplete” based on the amount of essential amino acids they contain. Contrary to popular belief, most foods — both animal- and plant-based ones — contain all nine essential amino acids. The difference lies in the amounts of them they offer. For instance, meat, fish, eggs, and dairy contain high levels of all nine essential amino acids. On the other hand, plants tend to contain low amounts of at least one or two essential amino acids, depending on the category to which they belong. For example, legumes and veggies tend to be low in methionine and cysteine, while grains, nuts, and seeds tend to be low in lysine (2). In practical terms, this means that following a diet providing too little of either food group may cause you to get insufficient amounts of essential amino acids. This is why animal-based foods are typically considered “complete” sources of protein, while most plant-based foods are considered “incomplete.” The exceptions are soy, quinoa, amaranth, buckwheat, and nutritional yeast, as well as hemp and chia seeds. These plant foods offer good amounts of all nine essential amino acids and are considered “complete” sources of plant protein. With a few exceptions, most plant-based foods are typically viewed as “incomplete” sources of protein. In contrast, animal-based foods are considered “complete” proteins. Many people believe that due to vegetarian and vegan diets’ low content of animal-based protein, they often lack sufficient amounts of “complete” protein. However, apart from a few exceptions, this is very seldom the reality. Currently, there’s no evidence of protein deficiency among vegetarians or vegans, except perhaps in the small percentage who eat too few calories or follow monotonous or restricted eating patterns, such as fruitarian or potato-based diets (3). Nonetheless, the protein found in plants can be slightly more difficult for your body to absorb, compared with the protein in meat and other animal-based foods. This is why vegetarians and vegans are sometimes encouraged to eat slightly more protein than meat eaters — that is, around 0.5 grams per pound (1 gram per kg) per day (4). That said, the current evidence suggests that this difference in absorption is likely too minimal to cause vegetarians or vegans to get insufficient amounts of essential amino acids from their diet (3). In short, as long as a plant-based diet remains rich enough in calories and offers a good variety of protein sources, there’s little reason to worry about getting too little “complete” protein on a vegetarian or vegan diet. Vegetarians and vegans should have little difficulty getting enough “complete” protein from their diet — that is, as long as it remains varied and rich enough in calories. Protein-rich foods that contain good amounts of all nine essential amino acids are typically considered “complete” sources of protein, while those that don’t are labeled as “incomplete” sources. This causes most plant foods to be viewed as “incomplete” proteins, perpetuating the myth that plant-based diets may not offer the right amount or type of protein. That said, as long as a plant-based diet contains a good variety of food groups and enough calories, there’s little reason for vegetarians or vegans to worry about “complete” or “incomplete” proteins. Note that this applies to healthy individuals of average weight. However, nutrient needs may vary depending on your activity level, body weight, and health status. If you’re losing weight or lack energy, consult a medical professional or registered dietitian.
