Publication Date	Time	Publisher	Author	Title	URL	Text
2020-09-15	18:20:00Z	newsindiatimes.com	Ela Dutt	Veganism: From fad to lifestyle	https://www.newsindiatimes.com/veganism-from-fad-to-lifestyle/	Thirty years ago, a few Indian-Americans got together to form Vegetarian Vision when they saw more and more Indian immigrants becoming non-vegetarian of the difficulty accessing their traditional Indian products. “People coming from India couldn’t find enough vegetarian food. So they were changing their lifestyle. We felt an organization like this was needed,” Chairman H.K. Shah, founder of Vegetarian Vision founded in 1992, now called World Vegan Vision, told News India Times. He and his wife turned vegan 15 years ago. For an Indian vegetarian, to turn to a vegan diet bereft of dairy products, is only to be imagined. But Shah does not think so. “Some people find it hard (without dairy),” he concedes, “But there are so many substitutes today and some of our 2,000 members have been vegan for more than 30 years,” he added. That membership is a far cry from the small group which formed the organization and also included Padma Shri Dr. Sudhir Parikh, chairman of Parikh Worldwide Media and ITV Gold,. The WVV has a membership that has also shifted over time, and now it is spreading its wings to India. On Sept. 9, World Vegan Vision, which opened branches in Mumbai and Delhi just before COVID-19 became a pandemic, hosted a reception to welcome India’s new Consul General in New York Randhir Jaiswal, at Akbar restaurant in New Jersey, a sign of its spreading wings. An interesting factoid is revealed with a search for vegans in America. The American Vegan Society, according to Wikipedia, was founded in 1960, by H. Jay Dinshah in Malaga, New Jersey, when he was just 26 years old, 3 years after he became a vegan. Dinshah married Freya Smith whose parents were active in The Vegan Society of U.K. He remained the president of the organization until 2000 when he died of a heart attack at the age of 66. He brought out a magazine called Ahimsa. As to how many vegans there are today in the U.S., the numbers differ from one study to another. An Ipsos Retail Performance survey in March 2020, estimated there were some 9.6 million Americans on a plant-based diet than there were 15 years ago, Vegannewsnow.com reported March 6, 2020. Livekindly.co referred to a 2004 survey by Time and CNN which found only 290,000 people in this country were interested in a vegan diet. Ipsos used that as its baseline. On the other extreme, Onegreenplanet.org, referring to “recent studies,” claims “30 percent of Americans are not only leaving meat off their plates but also seeking out plant-based meat alternatives,” a claim that could not be verified. The reality may be somewhere in between or even on the lower side. Foodwaysinfocus from Michigan State University, noted that the 2015 book, The Rise of Veganism: Start a Revolution, said only 2.5 percent of the American population is vegan, which however, was still a significant rise from the 1 percent it was in 2009. The Vegan Society, an organization formed back in 1944 in United Kingdom, quotes a 2016 Oxford University study which estimates that if the world went vegan, it could save 8 million human lives by 2050, reduce greenhouse gas emissions by two thirds and significantly affect climate change positively, not to mention reducing healthcare costs totalling some $1.5 trillion. The Oxford Martin School’s Programme on the Future of Food, built several models, and estimated that if a vegan diet was followed globally, it would cut food-related emissions by 70 percent, compared to 63 percent if everyone went vegetarian, and if ‘global dietary guidelines’ were followed, it would reduce only 29 percent. “Our analysis indicates that adopting global dietary guidelines would not be enough to reduce food-related greenhouse gas emissions to the same extent that total greenhouse gas emissions will need to fall to keep global temperature increases to below 2°C,” Dr. Marco Springmann, leader of the study, is quoted saying in the press release from Oxford University. When the U.S.-based Vegetarian Vision was established in 1992, it focused on spreading awareness not only about being vegetarian, but also where such foods could be procured by the new Indian immigrant, hosting events, and securing a following, not just of Indians but also white and black mainstream Americans. “At one time our membership was fifty-fifty Indian and non-Indian,” Shah said. Things have come a long way since then. Today, not only has vegetarianism caught on in Mainstream America, but vegan lifestyles are proliferating. While not statistically proven, it is reasonable to assume that many Americans know someone who is a vegan in their circle of associates and friends, and many who are vegetarians. World Vegan Vision’s overarching message on its website (worldveganvision.org) is, “Let us make the world free of violence and suffering,” and that includes the suffering of a calf whose mother is deprived of the milk meant for her. That is what turned Selina Dhunna, now 24, to the vegan regime when she was just 19 years old, followed by her mother. “The main message is about compassion – not just for humans but also animals and putting yourself in the animal’s position-Why would we drink someone else’s milk that is not meant for us?” Dhunna questions, adding, “Besides, many Indians or other South Asians don’t do too well with milk anyway, with lactose intolerance etc.” According to The Vegan Society, 1 in 5 Brits cut down on meat consumption during the COVID-19 pandemic to date. Certainly, veganism has moved from being seen as a fad to becoming a lifestyle that businesses are also pushing as they see customers lining up behind it.
2020-09-15	10:02:50Z	VegNews		Interest in Veganism Hits All-Time High in 2020, Google Trends Report Shows	https://vegnews.com/2020/9/interest-in-veganism-hits-all-time-high-in-2020-google-trends-report-shows	 September 15, 2020 Interest in veganism has hit an all-time high in 2020, according to a report compiled by food-centric media outlet Chef’s Pencil. Using Google Trends data, the report analyzed the popularity of vegan search terms around the world in a variety of languages. “Data from Google Trends show that the popularity of veganism is at an all-time high, surpassing the prior all-time high registered in 2019,” the report states. “To put things into perspective, veganism is now twice as popular as it was just five years ago, and it doesn’t show any sign of slowing down. Veganism is stronger than ever, as you can see by the number of countries whose cuisine traditionally is greatly meat- and dairy-based seeing a big rise in veganism.” Chef’s Pencil also used Google data to determine the top 15 countries and top 15 cities where veganism is most popular in 2020. The United Kingdom, Australia, and Israel hold the top three spots with the United States coming in near the bottom at 12th place. As for cities, UK’s Bristol overtook Portland, OR as the top city, with Edinburgh coming in third place just above London. Other data supports Chef’s Pencil report that interest in veganism is growing worldwide in 2020, particularly in light of COVID-19. In May, a report—compiled by trade group Plant Based Foods Association and market research company SPINS—found sales of plant-based foods in the US increased by 90 percent during the height of pandemic-buying in mid-March when compared to last year’s sales during that time period, with sales of plant-based meat spiking by 148 percent. Similarly, in a July report, online resource HappyCow found that more vegan restaurants opened than closed during the COVID-19 pandemic. Please support independent vegan media and get the very best in news, recipes, travel, beauty, products, and more. Subscribe now to the world’s #1 plant-based magazine! All-things vegan,in your mailbox and inbox Never miss out on exclusive stories, recipes, and giveaways
2020-09-10	20:17:56Z	BBC News	https://www.facebook.com/bbcnews	Why black Americans are more likely to be vegan	https://www.bbc.com/news/world-us-canada-53787329	Black Americans are almost three times as likely to be vegan and vegetarian than other Americans. Why is giving up meat so popular? When Louis Hunter woke up on the morning of 31 May he didn't know what to do. His hometown of Minneapolis was in disarray after a week of protests following the death of George Floyd, and many businesses - including his own restaurant, Trio Plant-Based - were shut down. "God just touched me and told me to go out and pass out all the food that I had prepared the day before," he told the BBC. In total, Mr Hunter gave away 300 vegan meals and bottles of water to Black Lives Matter protesters. The cause and his restaurant are inextricable in his heart. In 2016 he was facing 20 years in jail on felony rioting charges after participating in a Black Lives Matter protest following the death of his cousin, Philando Castile. Mr Hunter has always maintained his innocence, and charges were eventually dismissed, but he lost his landscaping business and apartment while the sentence hung over his head for over a year. Through his legal battle, he met white activist Sarah Woodcock, who introduced him to the concept of veganism. He started reading about how reducing or eliminating animal products can help reduce the likelihood of developing chronic illnesses like diabetes and high blood pressure - illnesses that plague the black community in the US. He says he also started to connect how racial injustice contributes to the poor diet that many African Americans eat. "At first I knew nothing about vegan, plant-based food at all," he said. "After that I started seeing the other ways we were being treated wrongly, as far as our eating habits." Although he does not identify as a vegan, which the Vegan Society defines as an ethical lifestyle choice that eschews all animal products, he says he now eats largely a plant-based diet that consists mainly of vegetables, fruits and legumes. The pair went into business, and after a series of pop-ups, opened Trio in the autumn of 2018. Now he is the sole proprietor, making Trio the first black-owned vegan restaurant in the state. The growth of Trio mirrors national trends, with everyone from athletes to pop stars jumping on board. But nowhere has the vegan diet taken off more than in the African-American community. According to Pew Research Center survey, 8% of black Americans are strict vegans or vegetarians, compared to just 3% of the general of the population. Those findings mirror a 2015 poll by the Vegetarian Resource Group, that found 8% of black people were strictly vegetarian, compared to 3.4% overall. Recently, a January poll by Gallup found that 31% of non-white Americans had reduced their meat consumption in the past year, compared to only 19% of white Americans. The trend is sparking a new generation of vegan influencers, like actress Tabitha Brown, who is getting her own cooking show after her vegan videos blew up on Tik Tok and Instagram (there is even an online petition to make Ms Brown the voice of Apple's Siri). This is one of my favorite vegan bacon substitutes! Good old carrot bacon!!! What’s your favorite bacon substitute?? #tabithabrown #vegan #carrotbacon #plantbased A post shared by Tabitha Brown (@iamtabithabrown) on Apr 12, 2020 at 2:53pm PDT Meanwhile, established celebrities like Beyonce, Lizzo and tennis star Venus Williams have all either gone vegan or tried veganism, with Beyonce even partnering in a "plant-based" meal delivery service. The singer made headlines a few years ago when she promised to give free tickets to her and her husband Jay Z's concerts for life to a fan who made the switch to veganism. So why has veganism become so popular with African-Americans? For many black vegans, their journey begins with a quest for a healthier lifestyle. African Americans have a higher rate of hypertension, type 2 diabetes, obesity and cancer than most other groups, in part because their diet is on average higher in salt and fat and lower in fruits and vegetables, research shows. But socioeconomic factors like poverty, living far from a greengrocer and easy access to fast food have made it harder for African Americans to eat healthily, according to the Food Empowerment Project, a non-profit aimed at ending food inequality. Numerous studies have showed that plant-based diets are associated with a lower-risk of developing chronic conditions. The NHS says that a balanced vegan or vegetarian diet can be "very healthy", but notes that it is not the only path to health. It cautioned that vegans need to be careful to plan their diet to get adequate protein and calcium through plant-based sources, and may need to take supplements to guard against B12 and iron deficiencies. One recent study published in the British Medical Journal found that while vegans had a lower rate of heart disease, they had a higher incidence of stroke. Researchers were not sure why, but told the BBC that it could be because of B12 deficiencies. Food quantity, aside from food quality, is also a key factor in maintaining a healthy body weight. Those issues have inspired several black-owned charities, like Compton Vegan, to deliver vegan meals to predominantly black inner-city communities. It's also one of the reasons why Mr Hunter wanted the menu at Trio to focus on foods his community would be familiar with and want to eat, comfort foods like burgers and soul food like collard greens and mac-and-cheese. But those foods don't have to be laden with bacon grease and full-fat cream, Mr Hunter says. The menu at his restaurant Trio veganises many soul food classics, using things like liquid smoke to give collard greens that bacon-y taste and cashews to make mac-and-cheese creamy without the cream. At first, most of his customers were white, but now about half of his business is black. "To nurture my community, is amazing. I pinch myself almost every day to see if it's real," he says. For Omowale Adewale, the founder of Black VegFest, a vegan festival created by and for the black community in New York City, connecting veganism to black culture is essential. But when the festival first debuted, it drew puzzled looks from many white vegans. "The vegan community has been white for so long, and sometimes it feels like they want to keep it white," he says. While the diet has been stereotyped as something exclusively for soy-latte swilling, upper-middle class white hipsters, there is a long history of black veganism in the US and abroad, he is quick to point out. "You love to see yourself represented. That's one of the main reasons why the black community has really galvanised around the vegan idea," he says. While many vegan organisations lobby to improve animal welfare, and Black VegFest is no exception, Mr Adewale also makes sure its platform addresses wider issues in the black community like the fight to end police brutality. After battling high-blood pressure as a young man, Mr Adewale was introduced to vegetarianism by his brother, and then later adopted a vegan diet after being introduced to it by members of the Rastafari religion, which emerged in Jamaica in the 1930s. A central tenet of Rastafarianism is eating "ital" foods - foods that are organic, locally grown and plant-based. Rasta-owned vegan and vegetarian restaurants can be found in cities around the world with a large Caribbean diaspora. Traditional African cuisines, while not strictly vegan, are also largely plant-based and rich in dark leafy greens and legumes - staples in a healthy diet. A recent study involving 48,000 people over 18 years compared the health of meat-eaters, pescatarians - who eat fish and dairy but not meat - and vegetarians, including some vegans. They found that people who eat vegan and vegetarian diets have a lower risk of heart disease, but a higher risk of stroke, possibly partly due to a lack of B12. The vegan movement also has deep roots with the American Civil Rights Movement. Dick Gregory, a famed civil rights activist and comedian who marched alongside Martin Luther King, gave up meat in 1965 and later became a strict vegan. "Because I'm a civil rights activist, I am also an animal rights activist. Animals and humans suffer and die alike. Violence causes the same pain, the same spilling of blood, the same stench of death, the same arrogant, cruel and vicious taking of life. We shouldn't be a part of it," he said. It was Gregory who introduced Tracye McQuirter to veganism over 30 years ago, when he gave a speech at Amherst College's black student union. Now, Ms McQuirter is one of the many writers and influencers who are helping make veganism mainstream in the black community. Her 2010 cookbook, By Any Greens Necessary, was specifically aimed at black women, and this year she is launching an online campaign to try and get 10,000 black women to go vegan. Ms McQuirter says that veganism is more important now than ever before, as Covid-19 ravages many black communities, in part because of their higher rate of pre-existing chronic conditions. Chronic disease and systemic racism are inextricable, she says. "While the root cause is systemic white supremacy, one of the symptoms is we have access to the unhealthiest foods," she says. As thousands march in Black Lives Matter protests, Ms McQuirter says it is "urgent for us to take care of ourselves and eat well so we have the energy to fight these battles".
2020-09-15	13:08:32Z	Healthline	Lauren Panoff, MPH, RD	Is Beeswax Vegan?	https://www.healthline.com/nutrition/is-beeswax-vegan	A vegan diet is defined as a way of eating that avoids animal-derived products and ingredients to the best of one’s ability. Veganism typically extends beyond diet and also aims to avoid the use of animal-derived ingredients or byproducts that are harvested in ways that may harm animals. Beeswax is the waxy substance produced by honeybees to construct their hives and contain honey. As honey is often avoided on a vegan diet, you may wonder whether beeswax should also be excluded. This article examines whether beeswax is considered a vegan product and appropriate to include in a vegan lifestyle. Beeswax is a common ingredient in many commercial products, such as food, beverages, cosmetics, candles, and personal care items, including dental floss, lotions, lip balm, and creams, as an emollient, thickener, and emulsifier (1). Produced by secretory glands on the undersides of worker bees, beeswax is the main construction material in the making of a beehive. It’s used by bees to create the honeycomb structure of their hive, as well as serve as caps to contain the bees’ honey (2). When honey is harvested, beeswax must first be scraped off of the beehive. The beeswax can then be melted down for its various commercial uses. Beeswax is a waxy substance produced by worker bees in the construction of hives and containment of honey. It’s used in a number of consumer products. A vegetarian product may be produced by animals or insects but not contain animal flesh itself. For example, vegetarians often consume eggs, honey, and dairy products. By this definition, beeswax can be considered a vegetarian product, as it’s made by bees but doesn’t contain bees themselves. However, determining whether beeswax is vegan requires a further look into the definition of veganism. While some companies harvest beeswax in a way that aims to protect bees from harm, the processes used don’t come without risk of hive disruption, damage, or accidental bee death. Furthermore, some people believe that disturbing animals or their habitats or taking something from them without their direct consent does not align with the principles of veganism. Based on this definition, even if beeswax is removed from hives in a way that avoids harming the bees directly, it’s still removed without their direct consent. Hence, while beeswax can be considered a vegetarian substance, it’s not truly a vegan ingredient. Beeswax does not contain animal or insect flesh and is considered vegetarian. However, there are concerns with how it’s harvested, as well as its effects on the bees, making it not a truly vegan ingredient. Beeswax is a waxy substance made by worker bees to construct hives and contain honey. It’s used in a variety of commercial food and consumer personal care products. While some companies employ beeswax harvesting methods that aim to minimize harm to bees or their hives, the risk of bee death remains. Furthermore, some people on a vegan diet believe that disrupting beehives without the ability to obtain consent from their owners goes against veganism. Therefore, beeswax is considered a vegetarian product, but it’s not vegan. At the end of the day, you have to decide whether the harvesting measures used are enough for you to feel that they align with your ethics. The best way to make this decision is to educate yourself on the practices used by individual companies. 
