,section,time,title,url
405,Society,2022-07-19T23:01:03Z,Are there enough concrete commitments in the women’s health strategy to truly ‘reset the dial’?,https://www.theguardian.com/society/2022/jul/20/are-there-enough-concrete-commitments-in-the-womens-health-strategy-to-truly-reset-the-dial
217,Opinion,2022-08-24T14:53:29Z,Republicans thought they had midterms in the bag. Voters just rejected them again | Lloyd Green,https://www.theguardian.com/commentisfree/2022/aug/24/republicans-thought-they-had-midterms-in-the-bag-voters-just-rejected-them-again
56,World news,2022-06-24T18:01:28Z,Abortion deserts: America’s new geography of access to care – mapped,https://www.theguardian.com/world/2022/jun/24/abortion-laws-by-state-map-clinics
317,US news,2022-07-13T20:03:03Z,Biden in Israel as poll shows support for re-election bid at new low – as it happened,https://www.theguardian.com/us-news/live/2022/jul/13/biden-israel-middle-east-inflation-us-politics-live
183,Australia news,2022-07-31T17:30:02Z,Victorian public hospitals could not prevent doctors from providing abortions under new bill,https://www.theguardian.com/australia-news/2022/aug/01/victorian-public-hospitals-could-not-prevent-doctors-from-providing-abortions-under-new-bill
570,US news,2022-08-14T06:00:04Z,How a wild week in Washington changed the game for Biden and Trump,https://www.theguardian.com/us-news/2022/aug/14/joe-biden-donald-trump-us-politics
511,US news,2022-09-19T09:55:55Z,UK bids grandest of farewells to the Queen | First Thing,https://www.theguardian.com/us-news/2022/sep/19/first-thing-uk-bids-grandest-of-farewells-to-the-queen
340,Australia news,2022-06-25T07:35:51Z,Victoria names new ministers; Penny Wong to travel to south-east Asia – as it happened,https://www.theguardian.com/australia-news/live/2022/jun/25/australia-news-live-updates-us-reacts-to-supreme-court-abortion-ruling-crossbench-anger-as-albanese-cuts-staffing-numbers
181,Opinion,2022-06-27T10:13:09Z,Black women could see a 33% increase in pregnancy-related deaths post-Roe. Why? | Tayo Bero,https://www.theguardian.com/commentisfree/2022/jun/27/abortion-black-women-roe-wade
97,Australia news,2022-06-27T01:23:34Z,‘Devastating’: Australian politicians respond to US supreme court’s decision on abortion rights,https://www.theguardian.com/australia-news/2022/jun/27/devastating-australian-politicians-respond-to-us-supreme-courts-decision-on-abortion-rights
114,Opinion,2022-07-10T09:45:31Z,Biden’s executive order on abortion is better than nothing. But not much better | Moira Donegan,https://www.theguardian.com/commentisfree/2022/jul/10/biden-executive-order-abortion-white-house
397,US news,2022-08-11T20:25:21Z,DoJ moves for Trump Mar-a-Lago search warrant to be unsealed – as it happened,https://www.theguardian.com/us-news/live/2022/aug/11/trump-fbi-subpoenas-republicans-gas-prices-biden-latest
278,Opinion,2022-08-06T13:00:15Z,In-person teaching has resumed in the US – but electronic snooping hasn’t stopped | Arwa Mahdawi,https://www.theguardian.com/commentisfree/2022/aug/06/school-surveillance-software-students-week-in-patriarchy
432,Global development,2022-07-26T11:45:14Z,Françafrique is back: Macron’s visit to Cameroon signals Colonisation 2.0,https://www.theguardian.com/global-development/2022/jul/26/francafrique-is-back-macrons-visit-to-cameroon-signals-colonisation-20
118,Australia news,2022-07-15T20:00:49Z,‘It was very traumatic for her’: how conscientious objection hinders women’s access to abortion,https://www.theguardian.com/australia-news/2022/jul/16/it-was-very-traumatic-for-her-how-conscientious-objection-hinders-womens-access-to-abortion
20,World news,2022-07-15T17:34:52Z,Abortion has always been safer than pregnancy and childbirth | Letters,https://www.theguardian.com/world/2022/jul/15/abortion-has-always-been-safer-than-pregnancy-and-childbirth
170,Global development,2022-07-05T05:30:15Z,"‘It was my right, but they refused’: Turkish women denied access to free, safe abortions",https://www.theguardian.com/global-development/2022/jul/05/legal-yet-virtually-banned-turkish-women-denied-right-to-free-safe-abortions
401,US news,2022-07-24T15:22:29Z,Pete Buttigieg urges Republicans to back same-sex marriage bill ,https://www.theguardian.com/us-news/2022/jul/24/pete-buttigieg-same-sex-bill-republicans-senate
389,Money,2022-07-21T09:00:44Z,‘It feels like a sinking ship’: inside Britain’s struggling nurseries,https://www.theguardian.com/money/2022/jul/21/it-feels-like-a-sinking-ship-inside-britains-struggling-nurseries
552,US news,2022-07-17T06:00:29Z,"The other Joe: how Manchin destroys Biden’s plans, angering Democrats",https://www.theguardian.com/us-news/2022/jul/16/joe-manchin-biden-climate-senate
54,World news,2022-06-25T10:00:11Z,How to support abortion access in a post-Roe America,https://www.theguardian.com/world/2022/jun/25/how-to-support-abortion-access-rights-us-roe-wade-funds
176,US news,2022-09-05T06:00:10Z,Could unexpected Democratic gains foil a midterm Republican victory?,https://www.theguardian.com/us-news/2022/sep/04/midterm-democrats-victory-republicans-trump
327,Opinion,2022-08-10T13:38:55Z,"Trump and Republicans’ terrible, no good, very bad week is about to get worse | Lloyd Green",https://www.theguardian.com/commentisfree/2022/aug/10/trump-republican-party-bad-week-fbi-raid
194,US news,2022-06-28T09:00:11Z,Fears of violence against pro-choice protests intensify amid wave of attacks,https://www.theguardian.com/us-news/2022/jun/28/peaceful-pro-choice-protests-violence-attacks-police
198,Australia news,2022-07-25T09:00:12Z,‘Voters don’t want a culture war’: Victorian Liberals raise concerns over preselections,https://www.theguardian.com/australia-news/2022/jul/25/victoria-health-minister-accuses-liberals-of-selecting-anti-abortion-bernie-finn-clone
470,US news,2022-08-12T21:44:52Z,US House passes Democrats’ landmark healthcare and climate bill,https://www.theguardian.com/us-news/2022/aug/12/us-house-passes-climate-bill-inflation-reduction-act
494,Stage,2022-08-20T13:00:40Z,Edinburgh fringe 2022 week two roundup: from a sheep shearer in peril to pure Hollywood escapism,https://www.theguardian.com/stage/2022/aug/20/edinburgh-fringe-2022-week-two-roundup-this-is-not-a-show-about-hong-kong-a-sudden-violent-burst-of-rain-blanket-ban-you-re-safe-til-2024-i-don-t-feel-anything-rosie-holt-voloz-collective-sophie-duker-hag-tim-crouch
352,Television & radio,2022-06-27T15:39:07Z,John Oliver on end of Roe v Wade: ‘We’re in uncharted territory’,https://www.theguardian.com/tv-and-radio/2022/jun/27/john-oliver-roe-v-wade-drought
182,US news,2022-07-25T07:00:32Z,The dystopian American reality one month after the Roe v Wade reversal,https://www.theguardian.com/us-news/2022/jul/25/us-abortion-bans-states-after-roe-v-wade
266,US news,2022-06-26T17:35:21Z,‘They set a torch to it’: Warren says court lost legitimacy with Roe reversal,https://www.theguardian.com/us-news/2022/jun/26/elizabeth-warren-democrats-question-supreme-court-legitimacy
354,US news,2022-08-26T12:55:19Z,‘Democrats have their mojo’: has the tide shifted for Biden and his party?,https://www.theguardian.com/us-news/2022/aug/26/democrats-have-their-mojo-has-the-tide-shifted-for-biden-and-his-party
103,US news,2022-07-13T00:23:32Z,‘Have you recently had an abortion?’ Australian transiting through US questioned then deported,https://www.theguardian.com/australia-news/2022/jul/13/have-you-recently-had-an-abortion-australian-transiting-through-us-questioned-then-deported
220,US news,2022-09-23T17:40:28Z,Republicans unveil 90s-throwback midterm election agenda,https://www.theguardian.com/us-news/2022/sep/23/republicans-midterm-elections-agenda-kevin-mccarthy
130,World news,2022-06-25T05:00:07Z,‘We will fight like hell’: US western states band together to protect abortion rights,https://www.theguardian.com/world/2022/jun/24/us-states-abortion-rights-california-oregon-washington
353,US news,2022-08-26T15:27:15Z,Revealed: leaked video shows Amy Coney Barrett’s secretive faith group drove women to tears,https://www.theguardian.com/us-news/2022/aug/26/amy-coney-barrett-faith-group-people-of-praise
371,Fashion,2022-09-14T16:14:26Z,‘Surprisingly sustainable’: fashion meets eco meets politics at New York fashion week,https://www.theguardian.com/fashion/2022/sep/14/new-york-fashion-week-sustainable-eco-politics
338,US news,2022-07-29T07:00:50Z,Pro-Israel group pours millions into primary to defeat Jewish candidate,https://www.theguardian.com/us-news/2022/jul/29/pro-israel-lobby-aipac-andy-levin-democratic-races
505,US news,2022-09-02T11:44:19Z,Biden warns US democracy imperiled by Trump extremists | First Thing,https://www.theguardian.com/us-news/2022/sep/02/first-thing-biden-warns-us-democracy-imperiled-by-trump-extremists
489,Television & radio,2022-07-12T09:26:07Z,"Bombs, blackmail and wire-taps: how I spent my childhood on the run from the FBI",https://www.theguardian.com/tv-and-radio/2022/jul/12/bombs-blackmail-and-wire-taps-how-i-spent-my-childhood-on-the-run-from-the-fbi
60,World news,2022-09-24T07:00:10Z,"What’s the difference between miscarriage and abortion? For some women, it’s hard to tell",https://www.theguardian.com/world/2022/sep/24/abortion-miscarriage-healthcare-pregnancy
94,Opinion,2022-09-10T17:00:08Z,Champagne and cigars are just fine. It’s Thérèse Coffey’s views on abortion that worry me | Catherine Bennett,https://www.theguardian.com/commentisfree/2022/sep/10/liz-truss-gifted-bff-tiz-chance-harm-womens-rights-to-abortion
193,Opinion,2022-09-06T10:15:16Z,"The Democrats are gaining because Americans want jobs, not Capitol mobs | Lloyd Green",https://www.theguardian.com/commentisfree/2022/sep/06/the-democrats-are-gaining-because-americans-want-jobs-not-capitol-mobs
140,World news,2022-07-12T05:00:20Z,"‘Thank the lord, I have been relieved’: the truth about the history of abortion in America",https://www.theguardian.com/world/2022/jul/12/thank-the-lord-i-have-been-relieved-when-abortion-was-safer-than-childbirth
416,US news,2022-09-16T20:01:50Z,January 6 panel could release report on Trump and Capitol attack before midterms – as it happened,https://www.theguardian.com/us-news/live/2022/sep/16/trump-special-master-documents-biden-south-africa-latest
148,US news,2022-09-23T20:01:24Z,US intelligence resumes national security review of Mar-a-Lago documents – as it happened,https://www.theguardian.com/us-news/live/2022/sep/23/trump-biden-midterms-republicans-democrats-us-politics-live-updates
476,Opinion,2022-08-18T10:00:44Z,Liz Cheney was purged by the cult of Trumpism. Who is next? | Richard Wolffe,https://www.theguardian.com/commentisfree/2022/aug/18/liz-cheneys-defeat-nature-of-trumpism
202,US news,2022-08-06T18:46:01Z,US jury finds in favor of pharmacist who denied woman morning-after pill,https://www.theguardian.com/us-news/2022/aug/06/morning-after-pill-contraception-judge-minnesota
152,World news,2022-07-04T05:12:14Z,"Monday briefing: Abortion is safe, supported, and available in the UK. Why is the law so complicated?",https://www.theguardian.com/world/2022/jul/04/first-edition-abortion-rights-uk
377,US news,2022-09-22T07:00:51Z,"Democrats will struggle to keep control of Congress in midterms, expert says",https://www.theguardian.com/us-news/2022/sep/22/democrats-congress-midterms-biden-ray-fair
391,Opinion,2022-07-15T10:24:36Z,Democrats are facing asymmetrical warfare. It’s time to wake up and fight back | Ben Davis,https://www.theguardian.com/commentisfree/2022/jul/15/democrats-are-facing-asymmetrical-warfare-its-time-to-wake-up-and-fight-back
337,US news,2022-08-11T17:16:34Z,Democrats’ midterm prospects perk up as Biden finally hits his stride,https://www.theguardian.com/us-news/2022/aug/11/democrats-midterms-win-projections-biden-republicans
380,Law,2022-07-27T13:14:26Z,Democrats introduce bill requiring term limits for US supreme court justices,https://www.theguardian.com/law/2022/jul/27/supreme-court-justices-term-limits-democrats-bill
535,Australia news,2022-06-28T21:03:47Z,"Morning mail: Turnbull tells French Albanese ‘is not Scott Morrison’, long passport wait times, Ghislaine Maxwell sentence",https://www.theguardian.com/australia-news/2022/jun/29/morning-mail-turnbull-tells-french-albanese-is-not-scott-morrison-long-passport-wait-times-ghislaine-maxwell-sentence
10,US news,2022-08-03T02:49:09Z,Kansas votes to protect abortion rights in state constitution,https://www.theguardian.com/us-news/2022/aug/03/kansas-abortion-vote-state-constitution
269,US news,2022-09-01T14:25:35Z,Wind in Democrats’ sails as Sarah Palin humbled in Alaska special election,https://www.theguardian.com/us-news/2022/sep/01/democrats-sarah-palin-mary-peltola-alaska-special-election
96,Global development,2022-07-06T11:57:59Z,Sierra Leone backs bill to legalise abortion and end colonial-era law,https://www.theguardian.com/global-development/2022/jul/06/sierra-leone-backs-bill-to-legalise-abortion-and-end-colonial-era-law
210,US news,2022-09-01T13:27:43Z,Pregnant Texas mother ticketed again for carpool lane Roe protest,https://www.theguardian.com/us-news/2022/sep/01/pregnant-texas-mother-ticketed-carpool-hov-lane-roe-wade-protest
593,Life and style,2022-08-13T06:00:34Z,‘I felt I was being assessed on my skin colour’: Black women around the world share their birth stories,https://www.theguardian.com/lifeandstyle/2022/aug/13/black-women-around-world-share-birth-stories-pregnancy-racism
557,US news,2022-07-30T06:00:18Z,America First is laying plans to perpetuate Trumpism beyond Trump,https://www.theguardian.com/us-news/2022/jul/30/america-first-trumpism-beyond-trump
332,US news,2022-09-07T18:09:50Z,Texas judge rules employers not required to cover HIV prevention drugs,https://www.theguardian.com/us-news/2022/sep/07/texas-employers-hiv-prevention-prep-drugs-ruling
75,US news,2022-07-27T17:58:24Z,"Teen bullied by Matt Gaetz raises over $200,000 for abortion rights funds ",https://www.theguardian.com/us-news/2022/jul/27/matt-gaetz-texas-teen-abortion-rights-funds
77,World news,2022-07-03T09:00:11Z,‘People want me dead’: abortion providers fear violence after Roe overturned,https://www.theguardian.com/world/2022/jul/03/abortion-providers-violence-danger-roe-wade
263,US news,2022-07-04T10:04:00Z,Fox and friends face billion-dollar US lawsuits | First Thing,https://www.theguardian.com/us-news/2022/jul/04/first-thing-fox-and-friends-face-billion-dollar-us-lawsuits
149,World news,2022-06-24T15:51:10Z,‘I was worried I had been permanently mutilated’: what abortion was like before Roe v Wade,https://www.theguardian.com/world/2022/jun/24/abortion-before-roe-v-wade-illegal-ann-hill
514,US news,2022-08-22T10:07:25Z,First Thing: Cheney turns on pro-Trump Republicans after defeat,https://www.theguardian.com/us-news/2022/aug/22/first-thing-cheney-turns-on-pro-trump-republicans-after-defeat
561,US news,2022-08-29T20:03:56Z,Critics denounce Lindsey Graham for warning of ‘riots in the street’ if Trump indicted – as it happened,https://www.theguardian.com/us-news/live/2022/aug/29/trump-fbi-documents-special-master-biden-us-politics-latest-updates
469,US news,2022-09-02T11:26:14Z,Biden warns US democracy imperiled by Trump and Maga extremists,https://www.theguardian.com/us-news/2022/sep/01/biden-speech-philadelphia-extremist-republicans-threaten-democracy
461,Opinion,2022-09-12T10:16:03Z,Alabama is jailing pregnant marijuana users to ‘protect’ fetuses | Moira Donegan,https://www.theguardian.com/commentisfree/2022/sep/12/alabama-jailing-pregnant-marijuana-users-protect-fetuses
253,US news,2022-09-09T10:02:36Z,Queen Elizabeth II’s death marks end of an era | First Thing,https://www.theguardian.com/us-news/2022/sep/09/first-thing-queen-elizabeth-iis-death-marks-end-of-an-era
369,Opinion,2022-07-03T12:16:14Z,The US norms the supreme court targeted this term all came from the same era | Bill McKibben and Akaya Windwood,https://www.theguardian.com/commentisfree/2022/jul/03/us-supreme-court-term-roe-v-wade
321,Technology,2022-08-22T18:04:26Z,Priti Patel urges Meta to rethink end-to-end encryption plans,https://www.theguardian.com/technology/2022/aug/22/priti-patel-urges-meta-to-give-up-on-end-to-end-encryption-plans
151,US news,2022-08-24T13:13:12Z,Texas judge blocks Biden order requiring hospitals to provide emergency abortions,https://www.theguardian.com/us-news/2022/aug/24/texas-judge-blocks-emergency-abortion-biden
302,US news,2022-08-19T20:00:48Z,"Americans should focus on Biden’s accomplishments, says chief of staff – as it happened",https://www.theguardian.com/us-news/live/2022/aug/19/biden-midterms-inflation-violence-trump-pence-latest-updates
190,Opinion,2022-06-26T16:40:34Z,The Guardian view on overturning Roe v Wade: anti-abortionists reign supreme | Editorial,https://www.theguardian.com/commentisfree/2022/jun/26/the-guardian-view-on-overturning-roe-v-wade-anti-abortionists-reign-supreme
348,US news,2022-07-07T20:02:30Z,US gunmakers summoned to Congress to justify soaring profits from gun violence – as it happened,https://www.theguardian.com/us-news/live/2022/jul/07/biden-democrats-climate-crisis-manchin-presidential-medal-freedom-latest
243,Society,2022-08-01T17:55:58Z,Archie Battersbee: how third parties can further complicate tragic life support cases,https://www.theguardian.com/society/2022/aug/01/archie-battersbee-another-tragedy-highlights-need-for-independent-mediation-in-cases-of-children
87,US news,2022-07-16T18:56:21Z,Joe Biden scraps plan to nominate anti-abortion lawyer to Kentucky judgeship,https://www.theguardian.com/us-news/2022/jul/16/joe-biden-chad-meredith-kentucky-judge
543,Opinion,2022-07-12T10:18:38Z,Democrats are certain to lose seats in the midterms. But how many – and why? | Musa al-Gharbi,https://www.theguardian.com/commentisfree/2022/jul/12/democrats-midterms-2024-republicans-joe-biden
418,Law,2022-07-02T06:00:38Z,Alarm as US supreme court takes a hatchet to church-state separation,https://www.theguardian.com/law/2022/jul/02/us-supreme-court-religion-church-state-separation
288,Opinion,2022-08-03T14:51:13Z,Tuesday’s primaries offered a glint of hope for Democrats this fall | Lloyd Green,https://www.theguardian.com/commentisfree/2022/aug/03/tuesdays-primaries-offered-a-glint-of-hope-for-democrats-this-fall
166,US news,2022-06-25T15:35:47Z,Patients in Texas clinics were waiting to get their abortions. Then Roe fell,https://www.theguardian.com/us-news/2022/jun/25/patients-abortion-texas-clinics-roe-v-wade
560,US news,2022-08-07T14:32:00Z,Democratic ads boosted extremists in Republican primaries. Was that wise?,https://www.theguardian.com/us-news/2022/aug/07/democrats-boosted-extremists-republican-primaries-was-that-wise
155,World news,2022-07-15T20:00:48Z,"‘No one makes these kinds of decisions lightly’: the fear, grief and relief in accessing abortion in Australia",https://www.theguardian.com/world/2022/jul/16/no-one-makes-these-kinds-of-decisions-lightly-the-fear-grief-and-relief-in-accessing-abortion-in-australia
356,Music,2022-07-04T10:01:34Z,Olivia Rodrigo review – pop punk icon fizzes with energy,https://www.theguardian.com/music/2022/jul/04/olivia-rodrigo-review-o2-academy-glasgow
381,Life and style,2022-07-23T20:00:48Z,"When a doctor announced my possible pregnancy, for the first time I didn’t feel frozen by dread",https://www.theguardian.com/lifeandstyle/2022/jul/24/when-a-doctor-announced-my-possible-pregnancy-for-the-first-time-i-didnt-feel-frozen-by-dread
279,US news,2022-09-12T20:00:45Z,Trump lawyers reject US government’s arguments against special master – as it happened,https://www.theguardian.com/us-news/live/2022/sep/12/trump-mar-a-lago-special-master-fbi-biden-latest
126,World news,2022-06-29T15:00:42Z,"Leak of Dobbs opinion brought deluge of online searches for abortion pills, study finds",https://www.theguardian.com/world/2022/jun/29/abortion-pills-online-search-results-dobbs
22,US news,2022-08-03T19:51:29Z,Kansas abortion referendum drives record number of voters to polls,https://www.theguardian.com/us-news/2022/aug/03/kansas-voter-turn-out-abortion-rights-election
282,US news,2022-08-27T09:00:24Z,As Republicans stumble – could Democrats really hold on to the Senate?,https://www.theguardian.com/us-news/2022/aug/27/democrats-senate-midterms-republicans
471,Life and style,2022-07-10T05:00:25Z,I fear my parents will disapprove of my new partner,https://www.theguardian.com/lifeandstyle/2022/jul/10/i-fear-my-parents-will-disapprove-of-my-new-partner
367,Opinion,2022-07-01T10:11:46Z,"What happened to us, the children of the 1960s? We have it all: we need to give some back | Polly Toynbee",https://www.theguardian.com/commentisfree/2022/jul/01/children-60s-uk-politics-postwar
25,US news,2022-07-08T17:17:40Z,Joe Biden signs executive order protecting access to abortion,https://www.theguardian.com/us-news/2022/jul/08/joe-biden-to-sign-order-offering-protection-women-denied-right-to-abortion
196,Opinion,2022-06-24T10:15:42Z,The US supreme court voted in favour of … people getting shot | Hamilton Nolan,https://www.theguardian.com/commentisfree/2022/jun/24/the-us-supreme-court-voted-in-favour-of-people-getting-shot
64,World news,2022-06-24T18:03:34Z,"US supreme court overturns abortion rights, upending Roe v Wade",https://www.theguardian.com/world/2022/jun/24/roe-v-wade-overturned-abortion-summary-supreme-court
15,Global development,2022-07-22T12:02:18Z,UK under international pressure over deletion of abortion commitments,https://www.theguardian.com/global-development/2022/jul/22/european-countries-pressurise-uk-over-removal-of-abortion-commitments-liz-truss
466,Film,2022-07-16T07:00:02Z,Streaming: the best lost-in-the-wilderness films,https://www.theguardian.com/film/2022/jul/16/streaming-the-best-lost-in-the-wilderness-films-the-lost-city
297,US news,2022-07-20T00:52:58Z,US House passes bill to protect right to same-sex and interracial marriage,https://www.theguardian.com/us-news/2022/jul/19/us-house-bill-protect-same-sex-interracial-marriage
336,US news,2022-09-08T06:00:10Z,"‘No rings, no guests’: supreme court fears spur LGBTQ ‘shotgun’ weddings",https://www.theguardian.com/us-news/2022/sep/08/lgbtq-couples-shotgun-weddings-supreme-court-fear
26,US news,2022-08-03T19:50:48Z,Biden signs second executive order to protect US abortion access,https://www.theguardian.com/us-news/2022/aug/03/biden-executive-order-protect-abortion-access
43,Television & radio,2022-08-22T22:05:44Z,Disability & Abortion: The Hardest Choice review – this intelligent documentary deserved two episodes,https://www.theguardian.com/tv-and-radio/2022/aug/22/disability-abortion-the-hardest-choice-review-this-intelligent-documentary-deserved-two-episodes
497,Opinion,2022-07-17T06:00:30Z,Give me a pale male PM with great policies over a ‘diverse’ one reinforcing inequality | Kenan Malik,https://www.theguardian.com/commentisfree/2022/jul/17/give-me-a-pale-male-prime-minister-with-great-policies-over-diverse-one-reinforcing-inequality
515,US news,2022-07-18T06:00:04Z, Too old to run again? Biden faces questions about his age as crises mount,https://www.theguardian.com/us-news/2022/jul/18/joe-biden-age-approval-rating-2024-election
571,US news,2022-08-31T20:09:45Z,"Trump ‘knowingly put national security at risk’ by stashing classified documents, Schiff says – as it happened",https://www.theguardian.com/us-news/live/2022/aug/31/trump-documents-move-hide-fbi-biden-politics-latest-updates
454,Opinion,2022-07-13T10:26:20Z,Joe Biden is deeply unpopular. But can Democrats find an alternative for 2024? | Ross Barkan,https://www.theguardian.com/commentisfree/2022/jul/13/democrats-2024-biden-alternative
387,Life and style,2022-09-07T05:00:39Z,"Having children may make you more conservative, study finds",https://www.theguardian.com/lifeandstyle/2022/sep/07/having-children-may-make-you-more-conservative-study-finds
71,US news,2022-07-29T07:30:50Z,Democratic cities in Texas push to blunt impact of state’s abortion ban,https://www.theguardian.com/us-news/2022/jul/29/democratic-cities-texas-abortion-ban-roe-v-wade
542,Stage,2022-09-09T13:00:34Z,‘There is nothing wrong with offending people’: Roddy Doyle on getting the band back together,https://www.theguardian.com/stage/2022/sep/09/roddy-doyle-commitments-musical-interview
456,US news,2022-07-29T20:03:20Z,DoJ reportedly preparing court fight to get Trump insiders to testify – as it happened,https://www.theguardian.com/us-news/live/2022/jul/29/trump-jan-6-manchin-biden-covid-boosters-us-politics-latest
431,Film,2022-07-25T05:00:26Z, ‘I’m just not afraid’: Lynda Carter on her online activism and Wonder Woman,https://www.theguardian.com/film/2022/jul/25/lynda-carter-interview-twitter-wonder-woman
264,US news,2022-07-29T08:15:21Z,"Potential rival or running mate? Kristi Noem, the governor denying Trump a face on Mount Rushmore",https://www.theguardian.com/us-news/2022/jul/29/potential-rival-or-running-mate-kristi-noem-the-governor-denying-trump-a-face-on-mount-rushmore
209,Media,2022-06-25T16:44:26Z,BBC’s Amol Rajan criticised for using phrase ‘pro-life’ in Roe v Wade interview,https://www.theguardian.com/media/2022/jun/25/bbc-amol-rajan-phrase-pro-life-roe-v-wade-interview
316,World news,2022-06-28T10:00:26Z,Why US women are deleting their period tracking apps ,https://www.theguardian.com/world/2022/jun/28/why-us-woman-are-deleting-their-period-tracking-apps
513,Australia news,2022-07-22T20:00:19Z,"‘No support’: Pacific Island labour-hire workers fear $6,000 cost of giving birth in Australia",https://www.theguardian.com/australia-news/2022/jul/23/no-support-pacific-island-labour-hire-workers-fear-6000-cost-of-giving-birth-in-australia
