,section,time,title,url
459,Film,2022-07-05T23:00:12Z,"Hello, Goodbye and Everything in Between review – charming Netflix romance",https://www.theguardian.com/film/2022/jul/05/hello-goodbye-and-everything-in-between-review-charming-netflix-romance
104,US news,2022-06-27T20:13:22Z,Louisiana judge blocks abortion ban amid uproar after Roe v Wade ruling,https://www.theguardian.com/us-news/2022/jun/27/louisiana-judge-abortion-ban-roe-v-wade-supreme-court
554,Australia news,2022-07-22T04:29:33Z,Splendour in the Grass chaos: first day of music festival cancelled amid wild weather,https://www.theguardian.com/australia-news/2022/jul/22/splendour-in-the-grass-2022-weather-rain-byon-bay-music-festival
361,US news,2022-07-14T10:10:13Z,Biden battered by inflation and low approval ratings | First Thing ,https://www.theguardian.com/us-news/2022/jul/14/first-thing-biden-battered-by-inflation-and-low-approval-ratings
365,Film,2022-07-27T12:39:44Z,"Ashley Judd says she met man who raped her, as part of ‘restorative justice’ process",https://www.theguardian.com/film/2022/jul/27/ashley-judd-met-man-who-raped-her-healing-with-david-kessler-podcast
225,US news,2022-07-05T06:00:16Z,"After Roe, are Republicans willing to expand the social safety net?",https://www.theguardian.com/us-news/2022/jul/05/roe-v-wade-abortion-republicans-social-safety-net
18,Media,2022-07-09T12:13:41Z,BBC Bitesize gave platform to ‘extreme’ anti-abortion group,https://www.theguardian.com/media/2022/jul/09/bbc-bitesize-gave-platform-to-extreme-anti-abortion-group
168,US news,2022-07-18T20:01:08Z,West Virginia to resume abortions after judge blocks enforcement of ban – as it happened,https://www.theguardian.com/us-news/live/2022/jul/18/us-faces-extreme-heat-biden-climate-crisis-plan-stalls-us-capitol-attack-latest-updates
493,Australia news,2022-08-22T20:55:34Z,"Morning mail: support for power bill caps, parents struggle with GP costs, Paine plans return",https://www.theguardian.com/australia-news/2022/aug/23/morning-mail-support-for-power-bill-caps-parents-struggle-with-gp-costs-paine-plans-return
567,US news,2022-09-06T09:00:54Z,"‘I’ve been Maced, I’ve been to jail …’ Can 25-year-old Maxwell Frost now be the first Gen Z member of Congress?",https://www.theguardian.com/us-news/2022/sep/06/ive-always-had-these-crazy-ideas-the-25-year-old-uber-driver-bidding-to-become-the-first-gen-z-member-of-congress
121,Opinion,2022-06-25T13:00:15Z,Abortion ruling highlights the war against women in America. Time to fight back | Arwa Mahdawi,https://www.theguardian.com/commentisfree/2022/jun/25/abortion-war-against-women-in-america
421,US news,2022-07-18T18:23:45Z,Anthony Fauci says he will retire by end of Joe Biden’s first term,https://www.theguardian.com/us-news/2022/jul/18/anthony-fauci-retire-biden-first-term-trump-covid
453,Music,2022-06-25T17:31:51Z,Glastonbury festival on BBC is my armchair pilgrimage to hipster Disneyland,https://www.theguardian.com/music/2022/jun/25/glastonbury-festival-on-bbc-is-my-armchair-pilgrimage-to-hipster-disneyland
506,US news,2022-07-19T20:01:49Z,Biden to make Wednesday climate address as dangerous heat grips US and world – as it happened,https://www.theguardian.com/us-news/live/2022/jul/19/biden-climate-emergency-congress-same-sex-marriage-bill-politics-latest
536,Australia news,2022-06-27T21:05:02Z,"Morning mail: Australia ‘ill-prepared’ for food insecurity, millennials overtaking boomers, Baz Luhrmann’s films ranked",https://www.theguardian.com/australia-news/2022/jun/28/morning-mail-australia-ill-prepared-for-food-insecurity-millennials-overtaking-boomers-baz-luhrmanns-films-ranked
403,Film,2022-07-21T06:03:40Z,‘You are not being heard’: the devastating black maternal mortality crisis in the US,https://www.theguardian.com/film/2022/jul/20/you-are-not-being-heard-the-devastating-black-maternal-mortality-crisis-in-the-us
597,US news,2022-07-05T02:46:35Z,Gun violence condemned after shooting at Fourth of July parade – as it happened,https://www.theguardian.com/us-news/live/2022/jul/04/chicago-shooting-fourth-july-parade-highland-park
291,US news,2022-06-30T20:09:56Z,Ketanji Brown Jackson sworn in to supreme court after ruling deals blow to climate crisis – as it happened,https://www.theguardian.com/us-news/live/2022/jun/30/us-supreme-court-decisions-climate-epa-immigration-kbj-latest
80,Opinion,2022-09-13T13:57:00Z,"Guess what, women can vote! Is that why even hardline anti-abortion Republicans are backtracking? | Arwa Mahdawi",https://www.theguardian.com/commentisfree/2022/sep/13/women-vote-anti-abortion-republicans-backtracking-roe-v-wade
46,Culture,2022-08-04T15:30:21Z,Seth Meyers on Kansas abortion vote: ‘A promising sign of progress’,https://www.theguardian.com/culture/2022/aug/04/seth-meyers-kansas-abortion-referendum
445,Opinion,2022-09-19T10:17:39Z,Ruling the US supreme court isn’t enough. The right wants to amend the constitution | Russ Feingold,https://www.theguardian.com/commentisfree/2022/sep/19/conservative-supreme-court-amend-constitution
274,Television & radio,2022-07-07T20:40:17Z,"The Baby review – post-Roe, this comedy-horror is truly terrifying",https://www.theguardian.com/tv-and-radio/2022/jul/07/the-baby-review-post-roe-this-comedy-horror-is-truly-terrifying
93,US news,2022-07-11T10:00:56Z,‘An inequality story’: Utah abortion ban will drive women further into poverty,https://www.theguardian.com/us-news/2022/jul/11/utah-abortion-ban-women-poverty-inequality
213,US news,2022-06-26T16:49:41Z,Protests continue across US to voice anger over supreme court ruling ,https://www.theguardian.com/us-news/2022/jun/26/abortion-rights-protests-across-us
410,Fashion,2022-09-06T09:40:15Z, ‘Clothes to lie in’: what Boris Johnson’s carefully tailored chaos tells us about the man,https://www.theguardian.com/fashion/2022/sep/06/clothes-to-lie-in-what-boris-johnsons-carefully-tailored-chaos-tells-us-about-the-man
106,Opinion,2022-08-19T06:00:08Z,Think abortion is legal in Great Britain? Ask the two women currently facing life sentences | Charlotte Proudman,https://www.theguardian.com/commentisfree/2022/aug/19/abortion-legal-great-britain-women-life-sentences-roe-v-wade
115,World news,2022-06-29T01:36:28Z,Spotlight back on abortion in New Zealand after US Roe v Wade ruling,https://www.theguardian.com/world/2022/jun/29/spotlight-back-on-abortion-in-new-zealand-after-us-roe-v-wade-ruling
488,US news,2022-08-31T10:53:39Z,"First Thing: Mikhail Gorbachev, ‘one-of-a kind’ Soviet leader, dies",https://www.theguardian.com/us-news/2022/aug/31/first-thing-mikhail-gorbachev-dies-soviet-leader
426,US news,2022-07-10T06:00:28Z,"The ‘Thomas court’: after biding his time, rightwing justice finds his power",https://www.theguardian.com/us-news/2022/jul/10/clarence-thomas-supreme-court-justice
359,Law,2022-07-24T08:30:02Z,Brenda Hale: ‘There’s absolutely no need to scrap the Human Rights Act’,https://www.theguardian.com/law/2022/jul/24/brenda-hale-theres-absolutely-no-need-to-scrap-the-human-rights-act
36,US news,2022-08-15T10:15:35Z,Abortion is still legal in Arizona. But confusion and fear abound,https://www.theguardian.com/us-news/2022/aug/15/arizona-abortion-laws-ban-access
333,Art and design,2022-07-07T12:40:42Z,Barbara Kruger: ‘Anyone who is shocked by what’s happening has not been paying attention’,https://www.theguardian.com/artanddesign/2022/jul/07/barbara-kruger-artist-roe-v-wade-abortion-art
204,World news,2022-06-24T20:16:03Z,"Contraception, gay marriage: Clarence Thomas signals new targets for supreme court",https://www.theguardian.com/world/2022/jun/24/clarence-thomas-roe-gay-marriage-contraception-lgbtq
244,US news,2022-07-04T20:15:00Z, Newsom airs Florida ad urging people to fight for freedom – or move to California,https://www.theguardian.com/us-news/2022/jul/04/gavin-newsom-florida-ad-fox-news-ron-desantis
221,Opinion,2022-08-30T10:15:04Z,Americans are starting to get it: we can’t let Trump – or Trumpism – back in office | Austin Sarat and Dennis Aftergut,https://www.theguardian.com/commentisfree/2022/aug/30/trump-republicans-voters-midterms-democrats
246,US news,2022-07-09T08:00:00Z,Biden in crisis mode as specter of one-term Carter haunts White House,https://www.theguardian.com/us-news/2022/jul/09/biden-democrats-jimmy-carter-crisis-white-house
342,US news,2022-09-22T20:03:02Z,Special master asks Trump team for proof of claims that FBI planted evidence – as it happened,https://www.theguardian.com/us-news/live/2022/sep/22/trump-mar-a-lago-records-justice-department-new-york-lawsuit-joe-biden-us-politics-latest
376,US news,2022-09-07T23:39:07Z,"Nuclear secrets reportedly found at Mar-a-Lago are ‘gamechanger’, experts say – as it happened",https://www.theguardian.com/us-news/live/2022/sep/07/trump-nuclear-document-special-master-biden-obama-bannon-latest
249,Opinion,2022-06-25T06:40:07Z,It’s time to say it: the US supreme court has become an illegitimate institution | Jill Filipovic,https://www.theguardian.com/commentisfree/2022/jun/25/us-supreme-court-illegitimate-institution
122,US news,2022-06-25T12:43:55Z,Abortion banned in multiple US states just hours after Roe v Wade overturned,https://www.theguardian.com/us-news/2022/jun/25/abortion-banned-in-multiple-us-states-just-hours-after-roe-v-wade-overturned
164,US news,2022-09-12T14:02:39Z,"‘Women are the reason we can win,’ John Fetterman says at Pennsylvania rally",https://www.theguardian.com/us-news/2022/sep/12/john-fetterman-pennsylvania-rally-abortion
512,World news,2022-09-19T06:00:34Z,Proud Boys memo reveals meticulous planning for ‘street-level violence’,https://www.theguardian.com/world/2022/sep/19/proud-boys-document-jan-6-violence
479,US news,2022-07-28T10:29:20Z,Manchin agrees deal on major Democrat domestic bill | First Thing ,https://www.theguardian.com/us-news/2022/jul/28/first-thing-manchin-agrees-deal-on-major-democrat-domestic-bill
239,US news,2022-08-11T10:21:06Z,Trump pleads the fifth in New York business investigation | First Thing,https://www.theguardian.com/us-news/2022/aug/11/first-thing-trump-pleads-the-fifth-in-new-york-business-investigation
425,World news,2022-06-24T10:21:03Z,Foetus fronts legal challenge over emissions in South Korea,https://www.theguardian.com/world/2022/jun/24/foetus-heads-legal-challenge-carbon-emissions-south-korea
484,UK news,2022-08-05T10:42:49Z,"Digested week: New York faces triple plague of rats, flies and racist mascots | Emma Brockes",https://www.theguardian.com/uk-news/2022/aug/05/digested-week-new-york-faces-triple-plague-of-rats-flies-and-racist-mascots
500,Books,2022-08-13T19:00:48Z,Salman Rushdie had started to believe his ‘life was normal again’,https://www.theguardian.com/books/2022/aug/13/salman-rushdie-had-started-to-believe-his-life-was-normal-again
70,US news,2022-07-08T18:51:29Z,Tinder owner halts political donations after support for anti-abortion group,https://www.theguardian.com/us-news/2022/jul/08/tinder-hinge-match-group-donations-abortion
318,Television & radio,2022-07-06T14:00:17Z,Keeping mum: TV’s problem with women who don’t want kids,https://www.theguardian.com/tv-and-radio/2022/jul/06/keeping-mum-tvs-problem-with-women-who-dont-want-kids
98,Opinion,2022-09-05T10:15:13Z,The abortion rights movement can learn from the Aids activism of the 80s and 90s | Moira Donegan,https://www.theguardian.com/commentisfree/2022/sep/05/abortion-rights-movement-aids-activism
305,US news,2022-08-24T20:01:03Z,Student loan forgiveness: Biden hails plan for ‘generation saddled with unsustainable debt’ – as it happened,https://www.theguardian.com/us-news/live/2022/aug/24/biden-student-loan-debt-ukraine-democrats-election-latest-updates
551,Australia news,2022-07-22T06:38:30Z,"‘Fanciful, nonsense’: case against Ben Roberts-Smith ‘based on conjecture’, lawyer tells defamation trial",https://www.theguardian.com/australia-news/2022/jul/22/fanciful-nonsense-case-against-ben-roberts-smith-based-on-conjecture-lawyer-tells-defamation-trial
30,US news,2022-07-07T15:29:57Z,Colorado governor issues executive order to protect abortion access,https://www.theguardian.com/us-news/2022/jul/07/colorado-governor-executive-order-protect-abortion
375,Life and style,2022-07-30T10:00:22Z,"‘You can’t say that!’: how to argue, better",https://www.theguardian.com/lifeandstyle/2022/jul/30/you-cant-say-that-how-to-argue-better
127,World news,2022-06-28T14:54:36Z,Labour MP in bid to include right to abortion in British bill of rights,https://www.theguardian.com/world/2022/jun/28/labour-mp-in-bid-to-include-right-to-abortion-in-british-bill-of-rights
1,Opinion,2022-09-24T13:00:06Z,US anti-abortion extremists are already waging war on IVF | Arwa Mahdawi,https://www.theguardian.com/commentisfree/2022/sep/24/republicans-ivf-abortion-week-in-patriarchy
301,World news,2022-09-23T14:01:31Z,Italian rightwing coalition makes final push before election,https://www.theguardian.com/world/2022/sep/23/italian-rightwing-coalition-makes-final-push-before-election
27,US news,2022-08-03T13:33:25Z,‘We could feel it’: Kansans celebrate upset abortion rights victory,https://www.theguardian.com/us-news/2022/aug/03/kansas-abortion-rights-referendum-reaction
89,Opinion,2022-07-06T06:00:21Z,Worried about abortion and demonic possession? You’d make a great Republican politician | Arwa Mahdawi,https://www.theguardian.com/commentisfree/2022/jul/06/worried-about-abortion-and-demonic-possession-youd-make-a-great-republican-politician
73,US news,2022-08-11T07:00:36Z,"After the fall of Roe, Republican pursuit of abortion bans appears to falter",https://www.theguardian.com/us-news/2022/aug/11/republicans-anti-abortion-policies-roe-v-wade-kansas
447,Opinion,2022-08-10T15:00:17Z,Spare me the fuss about children born ‘out of wedlock’ – this is the 21st century | Rhiannon Lucy Cosslett,https://www.theguardian.com/commentisfree/2022/aug/10/children-born-out-of-wedlock-21st-century
171,US news,2022-07-08T07:30:30Z,Pregnant women face increasingly dangerous risks as doctors flee punitive US states,https://www.theguardian.com/us-news/2022/jul/08/abortion-roe-v-wade-maternal-care-deserts-louisiana
355,US news,2022-07-12T23:28:44Z,"January 6 hearings: Trump tried to contact witness, Cheney says – as it happened",https://www.theguardian.com/us-news/live/2022/jul/12/jan-6-hearing-trump-extremist-groups-house-committee-us-politics-latest
408,US news,2022-06-27T15:51:18Z,Police arrest New York man accused of slapping Rudy Giuliani on back,https://www.theguardian.com/us-news/2022/jun/27/rudy-giuliani-slap-grocery-store-new-york-staten-island
480,Australia news,2022-07-07T08:29:55Z,Albanese says he’ll treat Putin with ‘contempt’ if paths cross at G20 summit – as it happened,https://www.theguardian.com/australia-news/live/2022/jul/07/australia-news-live-fourth-covid-booster-nsw-floods-jacinda-ardern-dominic-perrottet
91,Opinion,2022-08-04T10:25:05Z,The Kansas victory shows that Democrats can fight for abortion rights and win | Moira Donegan,https://www.theguardian.com/commentisfree/2022/aug/04/the-kansas-victory-shows-that-democrats-can-fight-for-abortion-rights-and-win
427,Opinion,2022-09-19T09:00:38Z,Italian politics has been in trouble for decades. Now it’s heading for a new low | Jamie Mackay,https://www.theguardian.com/commentisfree/2022/sep/19/italy-giorgia-meloni-politics-far-right
516,US news,2022-08-17T10:15:12Z,First Thing: Liz Cheney loses Wyoming Republican primary to Trump-endorsed rival,https://www.theguardian.com/us-news/2022/aug/17/first-thing-liz-cheney-loses-wyoming-republican-primary-to-trump-endorsed-rival
125,Opinion,2022-07-08T09:00:33Z,The brutal US abortion ruling is a potential death sentence for all pregnant women | Emma Brockes,https://www.theguardian.com/commentisfree/2022/jul/08/brutal-us-abortion-ruling-potential-death-sentence-pregnant-women
581,Politics,2022-07-07T11:46:28Z,His toxic spell is broken: Boris Johnson trips over his own lies | Jonathan Freedland,https://www.theguardian.com/politics/2022/jul/07/toxic-spell-broken-boris-johnson-trips-over-own-lies
12,US news,2022-09-12T06:00:06Z,‘A wakeup call’: more Republicans are softening staunch anti-abortion stance,https://www.theguardian.com/us-news/2022/sep/12/republicans-soften-staunch-anti-abortion-stance
344,US news,2022-08-04T10:17:35Z,China begins Taiwan military drills after Pelosi visit | First Thing,https://www.theguardian.com/us-news/2022/aug/04/first-thing-china-begins-taiwan-military-drills-after-pelosi-visit
599,Politics,2022-08-23T21:19:51Z,Tory leadership hustings – Birmingham: Liz Truss confirms she will allow new grammar schools – as it happened,https://www.theguardian.com/politics/live/2022/aug/23/liz-truss-tax-plan-rishi-sunak-boris-johnson-uk-politics-live
385,World news,2022-08-17T15:53:28Z,Chinese government attempts to boost birth rate with new policies,https://www.theguardian.com/world/2022/aug/17/chinese-government-birth-rate-policies-abortions-population
238,Opinion,2022-06-27T07:00:06Z,Let’s call the overturning of Roe v Wade what it is: state-sanctioned forced birth | Rhiannon Lucy Cosslett,https://www.theguardian.com/commentisfree/2022/jun/27/roe-wade-forced-birth-america-abortion-ban-misogyny
586,Australia news,2022-09-18T07:38:33Z,Albanese says he looks forward to working with Liz Truss – as it happened,https://www.theguardian.com/australia-news/live/2022/sep/18/australia-live-news-update-albanese-king-charles-british-pm-of-queens-funeral-londonaustralia-pandemic-covid-cases
452,Television & radio,2022-07-17T22:15:48Z,Better Things series five review – a life-affirming final outing that will leave a gaping hole in TV comedy,https://www.theguardian.com/tv-and-radio/2022/jul/17/better-things-series-five-review-a-life-affirming-final-outing-that-will-leave-a-gaping-hole-in-tv-comedy
441,Law,2022-08-02T15:37:27Z,Supreme court could strike blow against affirmative action in Harvard case ruling,https://www.theguardian.com/us-news/2022/aug/02/supreme-court-affirmative-action-harvard
143,US news,2022-06-24T17:30:46Z,Republican-run US states move to immediately ban abortion after court overturns Roe v Wade,https://www.theguardian.com/law/2022/jun/24/what-states-have-abortion-trigger-laws
341,News,2022-06-27T20:00:01Z,Corrections and clarifications,https://www.theguardian.com/news/2022/jun/27/corrections-and-clarifications
14,US news,2022-08-17T18:20:04Z,Florida court rules teenager ‘not mature enough’ to have abortion,https://www.theguardian.com/us-news/2022/aug/17/florida-pregnant-teenager-abortion-court
563,US news,2022-07-17T06:00:30Z,‘He could be a good president’: is Tucker Carlson the next Donald Trump?,https://www.theguardian.com/us-news/2022/jul/16/tucker-carlson-family-leadership-summit-president
578,US news,2022-07-11T08:00:01Z,How Elise Stefanik rose from moderate Republican to Maga star,https://www.theguardian.com/us-news/2022/jul/11/elise-stefanik-republican-rise-trump
208,US news,2022-07-11T19:14:56Z,FDA could approve over-the-counter purchase of first birth control pill,https://www.theguardian.com/us-news/2022/jul/11/birth-control-pill-no-prescription-over-the-counter-fda
131,Australia news,2022-07-02T07:51:23Z,Three rescued from flood waters; abortion rights protests; 54 Covid deaths – as it happened,https://www.theguardian.com/australia-news/live/2022/jul/02/australia-live-updates-anthony-albanese-emmanuel-macron-nsw-victoria-queensland-wet-weather-rain-flash-flooding-covid-coronavirus
174,US news,2022-06-28T17:47:34Z,Texas judge temporarily blocks state ban on abortions up to six weeks,https://www.theguardian.com/us-news/2022/jun/28/texas-abortion-ban-judge-temporarily-blocks
436,World news,2022-09-16T05:41:20Z,Friday briefing: What we do – and don’t – know about why Chris Kaba was shot dead by police,https://www.theguardian.com/world/2022/sep/16/first-edition-chris-kaba-met-police
191,Opinion,2022-07-01T10:19:13Z,I read the 1973 Roe v Wade ruling to see what we lost. Everyone should | Francine Prose,https://www.theguardian.com/commentisfree/2022/jul/01/roe-v-wade-1973-ruling-supreme-court
270,Art and design,2022-09-06T13:12:29Z,"Artist Zoë Buckman: ‘The UK is screwed, but not nearly as screwed as America’",https://www.theguardian.com/artanddesign/2022/sep/06/artist-zoe-buckman-the-uk-is-screwed-but-not-nearly-as-screwed-as-america
123,World news,2022-07-13T10:00:21Z,"‘At death’s door’: abortion bans endanger lives of high-risk patients, Texas study shows",https://www.theguardian.com/world/2022/jul/13/texas-abortion-ban-maternal-health-risk
138,US news,2022-08-09T18:27:36Z,Nebraska teen and her mother charged for aborting and burying fetus ,https://www.theguardian.com/us-news/2022/aug/09/nebraska-teen-charged-aborting-fetus
51,US news,2022-08-12T07:00:04Z,How they won: Kansas organizers unpack their big win for abortion rights,https://www.theguardian.com/us-news/2022/aug/12/how-abortion-rights-won-kansas-strategies
584,Television & radio,2022-08-21T06:00:01Z,"Emily Maitlis and Jon Sopel: ‘Risk, jeopardy, challenge. Whatever you want to call it we’ve got it’",https://www.theguardian.com/tv-and-radio/2022/aug/21/emily-maitlis-jon-sopel-the-news-agents-podcast-interview
112,Global development,2022-08-03T05:15:18Z,Feminists in India applaud their abortion rights – but they don’t extend to Dalit women  | Shreeja Rao ,https://www.theguardian.com/global-development/2022/aug/03/india-abortion-rights-dalit-women
265,US news,2022-08-25T20:20:36Z,US judge orders Trump Mar-a-Lago affidavit to be unsealed with redactions – as it happened,https://www.theguardian.com/us-news/live/2022/aug/25/trump-fbi-documents-mar-a-lago-biden-student-debt-campaign-latest-updates
382,US news,2022-06-29T20:00:17Z,Giuliani associate Lev Parnas handed 20 months in prison for campaign finance fraud – as it happened,https://www.theguardian.com/us-news/live/2022/jun/29/supreme-court-decisions-epa-trump-immigration-primary-elections-latest
272,US news,2022-09-09T13:07:17Z,Biden seeks to motivate voters from all parties against ‘Maga Republicans destroying politics’,https://www.theguardian.com/us-news/2022/sep/09/biden-motivate-voters-maga-republicans-midterm-elections
256,Politics,2022-06-28T21:35:48Z,Vandals target constituency office of Labour MP Stella Creasy,https://www.theguardian.com/politics/2022/jun/28/vandals-target-constituency-office-of-labour-mp-stella-creasy
486,US news,2022-07-15T20:39:11Z,Biden pledges executive action after Joe Manchin scuppers climate agenda,https://www.theguardian.com/us-news/2022/jul/15/joe-manchin-climate-funding-tax-hikes
105,US news,2022-07-18T09:00:07Z,Will abortion bans deny critical training to the next generation of ob-gyns? ,https://www.theguardian.com/us-news/2022/jul/18/abortion-bans-deny-critical-training-next-generation-ob-gyns
300,Australia news,2022-08-17T20:56:45Z,"Morning mail: wrongly imprisoned Indonesian boys plead for mercy, new emissions plan, Kabul mosque blast",https://www.theguardian.com/australia-news/2022/aug/18/morning-mail-wrongly-imprisoned-indonesian-boys-plead-for-mercy-new-emissions-plan-kabul-mosque-blast
590,Politics,2022-06-29T16:02:08Z,No 10 staff will be able to give evidence confidentially to inquiry into whether PM lied over Partygate – as it happened,https://www.theguardian.com/politics/live/2022/jun/29/ben-wallace-boris-johnson-nato-defence-conservatives-angela-rayner-dominic-raab-pmqs-uk-politics-latest-live
411,Media,2022-07-08T02:27:30Z,Independence day: Labor vows to end ABC board-stacking and ministerial interventions | The Weekly Beast,https://www.theguardian.com/media/2022/jul/08/independence-day-labor-vows-to-end-abc-board-stacking-and-ministerial-interventions
240,US news,2022-07-15T20:38:14Z,‘I will not back down’: Biden vows executive action if Senate cannot pass climate bill – as it happened,https://www.theguardian.com/us-news/live/2022/jul/15/joe-manchin-climate-biden-israel-saudi-arabia-middle-east-us-politics-latest
230,US news,2022-06-27T10:00:10Z,"‘A matter of life and death’: maternal mortality rate will rise without Roe, experts warn",https://www.theguardian.com/us-news/2022/jun/27/roe-v-wade-overturned-maternal-mortality-rate-will-rise
153,News,2022-06-29T08:00:34Z,"A Ukraine reboot / Liberty, undone: Inside the 1 July Guardian Weekly",https://www.theguardian.com/news/2022/jun/29/a-ukraine-reboot-liberty-undone-inside-the-1-july-guardian-weekly
326,US news,2022-08-10T15:50:07Z,Progressive Ilhan Omar wins closer-than-expected House primary in Minnesota,https://www.theguardian.com/us-news/2022/aug/10/ilhan-omar-minnesota-primary-victory-progressives
448,Media,2022-07-21T10:23:41Z,BBC to pay damages to ex-royal nanny over Bashir’s ‘deceitful’ Diana interview ,https://www.theguardian.com/media/2022/jul/21/bbc-pay-damages-ex-royal-nanny-bashir-diana-interview-tiggy-legge-bourke
392,US news,2022-07-28T20:03:29Z,Biden hails ‘most significant legislation to tackle climate crisis’ after Manchin says yes – as it happened,https://www.theguardian.com/us-news/live/2022/jul/28/joe-manchin-biden-democrats-climate-spending-bill-latest
294,Politics,2022-06-25T01:57:12Z,‘Go now’: what the papers say about Tories’ double byelection defeats,https://www.theguardian.com/politics/2022/jun/25/go-now-what-the-papers-say-about-tories-double-byelection-defeats
150,US news,2022-07-14T20:06:01Z,Republicans block bill on right to travel across state lines for abortions – as it happened,https://www.theguardian.com/us-news/live/2022/jul/14/joe-biden-middle-east-israel-inflation-polling-us-politics-latest
407,Sport,2022-06-26T09:00:39Z,"Martina Navratilova: ‘I try to do the right thing, not the popular thing’",https://www.theguardian.com/sport/2022/jun/26/martina-navratilova-do-the-right-thing-interview
