,section,time,title,url
163,US news,2022-07-24T06:00:03Z,Texas lawmakers test how far their threats against abortions can reach,https://www.theguardian.com/us-news/2022/jul/23/texas-republican-lawmakers-legal-threats-abortions
167,World news,2022-07-12T14:31:11Z,"US law overrules states on abortions in medical emergencies, health secretary says",https://www.theguardian.com/world/2022/jul/12/us-law-will-overrule-states-emergency-abortions
492,US news,2022-09-22T10:14:44Z,Do the latest legal woes spell the end for Donald Trump? | First Thing,https://www.theguardian.com/us-news/2022/sep/22/first-thing-do-the-latest-legal-woes-spell-the-end-for-donald-trump
206,Politics,2022-09-07T09:38:02Z,Thérèse Coffey defends Truss against ‘cabinet of chums’ charge,https://www.theguardian.com/politics/2022/sep/07/therese-coffey-defends-truss-against-cabinet-of-chums-charge
188,Opinion,2022-07-03T06:30:07Z,Danny Kruger has been hiding his real talent – he knows what women want | Catherine Bennett,https://www.theguardian.com/commentisfree/2022/jul/03/danny-kruger-has-been-hiding-his-real-talent-he-knows-what-woman-want
507,Opinion,2022-07-28T10:22:03Z,Chile is updating its constitution for the 21st century. The US should follow its lead,https://www.theguardian.com/commentisfree/2022/jul/28/chile-updating-constitution-us-should-follow
324,Australia news,2022-07-28T07:42:50Z,‘Final straw’: former Victorian Liberal MP quits party after Moira Deeming preselection,https://www.theguardian.com/australia-news/2022/jul/28/final-straw-former-victorian-liberal-mp-quits-party-after-moira-deeming-preselection
145,Global development,2022-06-28T05:00:07Z,"‘If you love or are a woman, don’t go to Malta,’ say couple in abortion drama ",https://www.theguardian.com/global-development/2022/jun/28/if-you-love-or-are-a-woman-dont-go-to-malta-say-couple-in-abortion-drama
383,Film,2022-09-08T17:00:09Z,"Blonde review – Some like it rotten: Monroe biopic is moving, explicit and intensely irritating",https://www.theguardian.com/film/2022/sep/08/blonde-review-some-like-it-rotten-monroe-biopic-is-moving-explicit-and-intensely-irritating
226,Opinion,2022-09-10T13:00:03Z,New ‘objective’ CNN appears to be making itself objectively rightwing,https://www.theguardian.com/commentisfree/2022/sep/10/objective-cnn-rightwing-week-in-patriarchy
216,Opinion,2022-08-01T10:22:20Z,This summer may be one of the most consequential in US democracy | Thomas Zimmer,https://www.theguardian.com/commentisfree/2022/aug/01/us-democracy-summer-most-consequential
481,World news,2022-07-01T19:00:24Z,"‘Free healthcare, bad Mexican food’: what life is really like for US expats in New Zealand",https://www.theguardian.com/world/2022/jul/02/free-healthcare-bad-mexican-food-what-life-is-really-like-for-us-expats-in-new-zealand
504,Australia news,2022-08-02T20:59:31Z,"Morning mail: Greens in ‘powerful position’ on climate, call for ‘virtual’ nurses, US house speaker visits Taiwan",https://www.theguardian.com/australia-news/2022/aug/03/morning-mail-greens-in-powerful-position-on-climate-call-for-virtual-nurses-nancy-pelosi-visits-taiwan
298,US news,2022-08-16T20:11:58Z,Biden hails ‘biggest step forward on climate ever’ as he signs Inflation Reduction Act – as it happened,https://www.theguardian.com/us-news/live/2022/aug/16/biden-climate-healthcare-bill-inflation-reduction-act-democrats-us-politics-latest
572,World news,2022-09-20T05:54:40Z,Tuesday briefing: Five big stories as Britain returns to normal,https://www.theguardian.com/world/2022/sep/20/tuesday-briefing-five-big-stories-as-britain-returns-to-normal
417,Music,2022-07-21T18:59:28Z,Billie Eilish: Guitar Songs EP review – engulfed in the horror and hope of 2022,https://www.theguardian.com/music/2022/jul/21/billie-eilish-guitar-songs-ep-review-developing-at-warp-speed
575,Books,2022-09-10T08:00:03Z,"Author Orhan Pamuk: ‘I used to have three bodyguards, now I have one’",https://www.theguardian.com/books/2022/sep/10/author-orhan-pamuk-i-used-to-have-three-bodyguards-now-i-have-one
457,UK news,2022-09-18T19:54:25Z,World leaders arrive to pay last respects to Queen as nation waits,https://www.theguardian.com/uk-news/2022/sep/18/world-leaders-arrive-pay-respects-queen-nation-waits-funeral
175,US news,2022-06-26T20:28:54Z,Many US companies move to pay travel costs for employees seeking abortions,https://www.theguardian.com/us-news/2022/jun/26/us-companies-pay-travel-costs-for-employees-seeking-abortions
538,US news,2022-07-20T11:23:24Z,First Thing: Biden under pressure to declare US climate emergency,https://www.theguardian.com/us-news/2022/jul/20/first-thing-biden-under-pressure-to-declare-us-climate-emergency
498,Books,2022-09-12T03:44:39Z,From Brian Cox to burnout: six things we learned at Melbourne writers’ festival,https://www.theguardian.com/books/2022/sep/12/from-brian-cox-to-burnout-six-things-we-learned-at-melbourne-writers-festival
229,US news,2022-08-31T05:00:21Z,Kellyanne Conway to Republicans who want to dump Trump: ‘You first’,https://www.theguardian.com/us-news/2022/aug/30/kellyanne-conway-republicans-trump-fox-news
579,World news,2022-08-22T05:30:23Z,Monday briefing: Italy’s political dysfunction opens the door to a far-right prime minister,https://www.theguardian.com/world/2022/aug/22/first-edition-giorgia-meloni-italy-election
280,US news,2022-08-18T10:00:43Z,Democratic boot camp: party intensifies local tactics ahead of midterms,https://www.theguardian.com/us-news/2022/aug/18/democrats-local-races-elections-midterms
409,Books,2022-07-15T09:00:34Z,Tahmima Anam: ‘A lot of my feminist rage was born when I read The Bell Jar’ ,https://www.theguardian.com/books/2022/jul/15/tahmima-anam-a-lot-of-my-feminist-rage-was-born-when-i-read-the-bell-jar
228,US news,2022-07-08T05:00:29Z,‘It’s incredibly far-reaching’: medical students on the Roe reversal,https://www.theguardian.com/us-news/2022/jul/08/roe-v-wade-reversal-medical-students
100,Law,2022-06-26T07:00:38Z,‘A mockery of democracy’: US supreme court in question after abortion ruling,https://www.theguardian.com/law/2022/jun/26/us-supreme-court-abortion-ruling-democracy
290,US news,2022-09-02T03:18:15Z,Five key takeaways from Biden’s speech on the threat to democracy,https://www.theguardian.com/us-news/2022/sep/01/joe-biden-democracy-speech-trump-key-takeaways
533,Stage,2022-08-26T13:00:30Z,How to say the unsayable: the comics tackling anti-‘woke’ trolling,https://www.theguardian.com/stage/2022/aug/26/anti-woke-comedians-erika-ehler-hannah-fairweather-jerry-sadowitz-edinburgh-fringe
366,UK news,2022-08-21T13:59:20Z,Royal with attitude? Duchess of Kent admits to being Ice Cube fan,https://www.theguardian.com/uk-news/2022/aug/21/duchess-of-kent-ice-cube-fan
53,Australia news,2022-06-26T08:00:38Z,Australian politicians respond to US abortion decision – as it happened,https://www.theguardian.com/australia-news/live/2022/jun/26/australia-news-live-updates-daniel-andrews-defends-new-ministers-federal-crossbenchers-livid-live
227,Opinion,2022-06-24T14:18:43Z,Roe v Wade has been overturned. Here’s what this will mean | Moira Donegan,https://www.theguardian.com/commentisfree/2022/jun/24/overturning-roe-story-is-women-unfreedom
577,Politics,2022-09-07T21:47:17Z,As it happened: White House issues trade warning over Northern Ireland protocol,https://www.theguardian.com/politics/live/2022/sep/07/liz-truss-cabinet-news-pm-therese-coffey-uk-politics-live
598,Australia news,2022-08-04T09:14:38Z,Penny Wong warns against ‘miscalculation’ as China-Taiwan tensions escalate – as it happened,https://www.theguardian.com/australia-news/live/2022/aug/04/climate-bill-emissions-targets-labor-greens-housing-economy-covid-cases-hospitalisation-indigenous-australians-voice
154,US news,2022-08-25T17:14:48Z,Slew of trigger laws kick in as three more US states ban abortions,https://www.theguardian.com/us-news/2022/aug/25/us-abortion-trigger-bans-laws-tennessee-texas-idaho
251,US news,2022-08-24T02:34:21Z,Florida: Charlie Crist wins Democratic primary to challenge Ron DeSantis,https://www.theguardian.com/us-news/2022/aug/23/florida-charlie-crist-wins-ron-desantis-democratic-primary
275,Opinion,2022-06-27T10:16:09Z,We Americans are dancing on the Titanic. Our iceberg is not far away | Francine Prose,https://www.theguardian.com/commentisfree/2022/jun/27/we-americans-are-dancing-on-the-titanic-our-iceberg-is-not-far-away
158,US news,2022-08-22T06:00:30Z,‘The world flipped upside down’: will end of Roe galvanize Democrats’ base in midterms? ,https://www.theguardian.com/us-news/2022/aug/22/democrats-abortion-rights-midterms-november
271,US news,2022-08-26T20:59:03Z,Trump search affidavit reveals potential for ‘evidence of obstruction’ at Mar-a-Lago – as it happened,https://www.theguardian.com/us-news/live/2022/aug/26/trump-affidavit-fbi-biden-abortion-student-loan-latest-updates
44,Opinion,2022-07-30T13:00:26Z,"Yes, Republicans really did try to make abortion punishable by death | Arwa Mahdawi",https://www.theguardian.com/commentisfree/2022/jul/30/republicans-abortion-punishable-by-death
589,Life and style,2022-08-06T06:00:08Z,Tom Daley on his LGBTQ+ awakening: ‘I had my head in my hands. I felt so dark about being British’,https://www.theguardian.com/lifeandstyle/2022/aug/06/tom-daley-lgbtq-awakening-gay-rights-british-commonwealth-documentary
113,Australia news,2022-08-02T17:30:05Z,Moira Deeming pictured alongside Liberal colleague at anti-abortion Zoom meeting during Melbourne lockdown,https://www.theguardian.com/australia-news/2022/aug/03/moira-deeming-pictured-alongside-liberal-colleague-at-anti-abortion-zoom-meeting-during-melbourne-lockdown
444,US news,2022-09-21T06:00:21Z,Biden declared victory over big pharma – but is it enough to sway senior voters?,https://www.theguardian.com/us-news/2022/sep/21/biden-big-pharma-senior-voters-midterms
211,US news,2022-06-25T06:00:07Z,Democrats hope to tap anger over Roe in November midterms – will it work?,https://www.theguardian.com/us-news/2022/jun/25/democrats-abortion-roe-v-wade-november-midterms
108,US news,2022-07-30T01:38:16Z,"‘What about my life?’ West Virginia girl, 12, speaks out against anti-abortion bill ",https://www.theguardian.com/us-news/2022/jul/28/west-virginia-girl-12-speaks-out-against-anti-abortion-bill
320,US news,2022-09-09T20:00:43Z,DoJ bids to regain access to classified documents seized in Trump search – as it happened,https://www.theguardian.com/us-news/live/2022/sep/09/trump-classified-documents-special-master-biden-ohio-chips-latest-updates
169,World news,2022-09-18T07:00:07Z,‘I can’t stay silent’: Roe reversal powers new generation to sign up and vote,https://www.theguardian.com/world/2022/sep/18/roe-v-wade-abortion-us-politics-november-midterms
79,Books,2022-07-15T09:01:28Z,A complicated story: why we need nuanced depictions of abortion in books,https://www.theguardian.com/books/2022/jul/15/a-complicated-story-why-we-need-nuanced-depictions-of-abortion-in-books
50,US news,2022-07-27T22:03:19Z,Indiana investigates abortion doctor who treated 10-year-old rape victim ,https://www.theguardian.com/us-news/2022/jul/27/indiana-investigates-abortion-doctor-10-year-old-rape-victim
84,World news,2022-08-01T15:42:16Z,‘I’m not a radical’: Kansas split ahead of critical post-Roe abortion vote,https://www.theguardian.com/world/2022/aug/01/kansas-abortion-vote-value-them-both-amendment
8,US news,2022-08-24T17:27:23Z,Democrats’ hopes rise for midterms amid backlash over abortion access,https://www.theguardian.com/us-news/2022/aug/24/democrats-midterms-abortion-pat-ryan
32,World news,2022-06-25T09:00:10Z,My state just banned abortion. What are my options? ,https://www.theguardian.com/world/2022/jun/25/abortion-ban-options-travel-pills-financial-legal-help
99,World news,2022-08-15T15:13:03Z,"‘More vocal, more aggressive’: calls grow for protest buffer zone at Bournemouth abortion clinic",https://www.theguardian.com/world/2022/aug/15/bournemouth-abortion-clinic-seeks-protest-buffer-zone
109,Global development,2022-06-24T16:30:39Z,‘Blood on their hands’: world’s medics condemn US overturn of abortion rights,https://www.theguardian.com/global-development/2022/jun/24/worlds-medics-condemn-us-overturn-abortion-rights
136,US news,2022-07-02T10:00:42Z,‘Police may be at your hospital bed’: an abortion rights activist on post-Roe criminalization,https://www.theguardian.com/us-news/2022/jul/02/renee-bracey-sherman-abortion-rights-activist-roe-v-wade
330,Stage,2022-09-14T08:31:52Z,Shakers: Under New Management review – zero-hours Godber spikes the punch,https://www.theguardian.com/stage/2022/sep/14/shakers-under-new-management-review-theatre-royal-wakefield-john-godber
222,Opinion,2022-06-30T10:20:36Z,The Roe ruling is not about states’ rights. It’s about power and control | Derecka Purnell,https://www.theguardian.com/commentisfree/2022/jun/29/roe-v-wade-dobbs-abortion-ruling-states-power-control
28,US news,2022-09-16T19:34:29Z,California governor’s ad campaign offers help to women in anti-abortion states,https://www.theguardian.com/us-news/2022/sep/16/california-governor-gavin-newsom-ads-abortion
287,US news,2022-08-23T15:20:43Z,Florida governor Ron DeSantis attacks media in ‘Top Gun’ campaign ad,https://www.theguardian.com/us-news/2022/aug/23/florida-governor-ron-desantis-top-gun-republicans
522,Australia news,2022-07-21T17:30:38Z,"Federal Icac to cover private contractors working for government, attorney general says",https://www.theguardian.com/australia-news/2022/jul/22/federal-icac-to-cover-private-contractors-working-for-government-attorney-general-says
55,Global development,2022-07-03T10:30:12Z,"Canada should focus on abortion access not legislation, advocates say",https://www.theguardian.com/global-development/2022/jul/03/canada-abortion-access-legislation
156,US news,2022-07-14T14:03:27Z,Man charged with rape of 10-year-old who had abortion after rightwing media called story ‘not true’,https://www.theguardian.com/us-news/2022/jul/14/man-charged-10-year-old-abortion-rightwing-media-indiana-ohio
526,Opinion,2022-09-07T10:20:02Z,The Democrats’ best message for the midterms: democracy is in grave peril | Osita Nwanevu,https://www.theguardian.com/commentisfree/2022/sep/07/democrats-midterms-democracy-republicans
537,World news,2022-09-16T20:00:27Z,"‘Honey-child, listen to me’: a radical Buddhist nun on how to be happy in a crazy world",https://www.theguardian.com/world/2022/sep/17/honey-child-listen-to-me-a-radical-buddhist-nun-on-how-to-be-happy-in-a-crazy-world
310,US news,2022-07-25T20:16:41Z,Judge blocks Georgia DA from investigating ‘fake elector’ in setback for Trump inquiry – as it happened,https://www.theguardian.com/us-news/live/2022/jul/25/us-economy-closer-to-recession-congress-recess-biden-agenda-covid-latest-updates
48,US news,2022-06-30T15:57:23Z,Biden backs exception to Senate filibuster to protect abortion access,https://www.theguardian.com/us-news/2022/jun/30/filibuster-abortion-vote-exception-joe-biden
83,World news,2022-07-21T17:30:39Z,"Medicare reforms are essential for creating fairer national abortion system, say advocates",https://www.theguardian.com/world/2022/jul/22/medicare-reforms-are-essential-for-creating-fairer-national-abortion-system-say-advocates
491,US news,2022-09-06T20:04:08Z,Trump’s Mar-a-Lago legal victory starts search for special master – as it happened,https://www.theguardian.com/us-news/live/2022/sep/06/trump-special-master-judge-documents-biden-campaign-latest-updates
33,World news,2022-06-25T03:58:12Z,World leaders condemn US abortion ruling as ‘backwards step’,https://www.theguardian.com/world/2022/jun/25/world-leaders-condemn-us-abortion-ruling-as-backwards-step
35,US news,2022-09-23T08:00:29Z,DeSantis to face trial for suspension of prosecutor who defied abortion ban law,https://www.theguardian.com/us-news/2022/sep/23/ron-desantis-andrew-warren-abortion-ban-lawsuit-trial
331,Opinion,2022-06-27T06:25:04Z,Republicans have hijacked the US supreme court. It’s time to expand it | David Daley,https://www.theguardian.com/commentisfree/2022/jun/27/us-supreme-court-abortion-roe-v-wade-justices-expansion
63,US news,2022-08-03T02:28:14Z,"Abortion access, Trump’s sway and US democracy hang in balance in primaries",https://www.theguardian.com/us-news/2022/aug/02/primaries-abortion-trump-arizona-missouri-michigan-kansas-washington-races
413,Opinion,2022-09-22T12:15:01Z,"To survive, unionism now has to be inclusive of Northern Ireland’s Catholics | Malachi O'Doherty",https://www.theguardian.com/commentisfree/2022/sep/22/unionism-northern-ireland-catholic-majority-protestant-unionism
384,US news,2022-08-21T13:37:44Z,Alarm over Texas law forcing schools to display ‘In God We Trust’ signs,https://www.theguardian.com/us-news/2022/aug/21/texas-in-god-we-trust-posters-law
530,Australia news,2022-07-07T21:12:05Z,"Morning mail: Boris Johnson resigns, Penny Wong to meet Chinese minister, tissue shortage",https://www.theguardian.com/australia-news/2022/jul/08/morning-mail-boris-johnson-resigns-penny-wong-to-meet-chinese-minister-tissue-shortage
322,Australia news,2022-08-07T22:28:56Z,"Melbourne’s western suburbs need real solutions, not an anti-trans culture war | Antoun Issa",https://www.theguardian.com/australia-news/commentisfree/2022/aug/08/melbournes-western-suburbs-need-real-solutions-not-an-anti-trans-culture-war
372,Australia news,2022-07-29T08:44:16Z,Queensland Health to review medical costs for sexual assault victims by end of year,https://www.theguardian.com/australia-news/2022/jul/29/queensland-health-to-review-medical-costs-for-sexual-assault-victims-by-end-of-year
428,World news,2022-09-01T14:44:18Z,"China’s treatment of Uyghurs may be crime against humanity, says UN human rights chief",https://www.theguardian.com/world/2022/aug/31/china-uyghur-muslims-xinjiang-michelle-bachelet-un
234,World news,2022-06-24T20:46:22Z,‘Outrage and action’: protesters young and old gather outside supreme court,https://www.theguardian.com/world/2022/jun/24/demonstrators-supreme-court-protest-dobbs-decision
412,US news,2022-07-31T09:00:50Z,Lucas Kunce: ‘Populism is about everyday people coming together’,https://www.theguardian.com/us-news/2022/jul/31/lucas-kunce-populism-missouri-senate-democrat-primary
596,Politics,2022-08-17T15:55:25Z,"Liz Truss’s plan for cost of living crisis would lead to ‘moral failure’, says Rishi Sunak – as it happened",https://www.theguardian.com/politics/live/2022/aug/17/labour-british-workers-liz-truss-rishi-sunak-tory-leadership-race-belfast-hustings-uk-politics-live
343,Music,2022-06-25T19:14:13Z,‘So many women are going to die’: Olivia Rodrigo lambasts Roe v Wade decision at Glastonbury,https://www.theguardian.com/music/2022/jun/25/so-many-women-are-going-to-die-olivia-rodrigo-lambasts-roe-vs-wade-decision-at-glastonbury
45,US news,2022-07-12T09:00:24Z,US employers’ support for workers’ abortion care leaves serious gaps,https://www.theguardian.com/us-news/2022/jul/12/abortion-us-employers-support-workers-serious-gaps
424,US news,2022-08-23T05:00:04Z,Florida voters head to primary polls as Democrats look to break losing streak,https://www.theguardian.com/us-news/2022/aug/23/florida-primaries-voters-republicans-democrats
303,Opinion,2022-07-02T13:00:47Z,Florida’s ‘don’t say gay’ law may sound vague – but its purpose is clear | Arwa Mahdawi,https://www.theguardian.com/commentisfree/2022/jul/02/dont-say-gay-florida-week-in-patriarchy
527,Games,2022-07-12T11:02:07Z,Pushing Buttons: Is it game over for gaming’s pandemic boom?,https://www.theguardian.com/games/2022/jul/12/pushing-buttons-is-it-game-over-for-gaming-pandemic-boom
177,US news,2022-07-02T08:00:39Z,The week the supreme court reshaped America: ‘We’re being hurled back decades’,https://www.theguardian.com/us-news/2022/jul/02/us-supreme-court-abortion-guns-america
219,World news,2022-06-27T05:16:03Z,Monday briefing: How the end of Roe v Wade has already transformed America,https://www.theguardian.com/world/2022/jun/27/first-edition-roe-wade
519,World news,2022-07-22T19:00:17Z,National’s plan for New Zealand’s inflation crisis is merely tax cuts for the wealthy,https://www.theguardian.com/world/commentisfree/2022/jul/23/nationals-plan-for-new-zealands-inflation-crisis-is-merely-tax-cuts-for-the-wealthy
296,Opinion,2022-07-03T10:26:11Z,Women’s rights have suffered a grim setback. But history is still on our side | Rebecca Solnit,https://www.theguardian.com/commentisfree/2022/jul/03/abortion-roe-v-wade-womens-rights-rebecca-solnit
21,World news,2022-07-30T18:00:32Z,Pregnant woman shocked after GP ‘gave her anti-abortion leaflet’,https://www.theguardian.com/world/2022/jul/30/pregnant-woman-shocked-gp-anti-abortion-leaflet-society-protection-unborn-children-spuc
248,US news,2022-09-14T20:04:47Z,Biden touts efforts to boost electric vehicles at Detroit auto show – as it happened,https://www.theguardian.com/us-news/live/2022/sep/14/trump-special-master-jan-6-committee-next-hearing-biden-detroit-politics-latest
587,Life and style,2022-07-25T08:00:30Z,They used her eggs to have a baby. Now they’re one big family ,https://www.theguardian.com/lifeandstyle/2022/jul/25/egg-donation-infertility-open-blended-families-ivf
420,Australia news,2022-06-30T21:10:57Z,"Morning mail: Pacific islands may pull troubled Australian boats, Ukraine retakes Snake Island, carbon credit review",https://www.theguardian.com/australia-news/2022/jul/01/morning-mail-pacific-islands-may-pull-troubled-australian-boats-ukraine-retakes-snake-island-carbon-credit-review
325,News,2022-07-11T20:00:08Z,Corrections and clarifications,https://www.theguardian.com/news/2022/jul/11/corrections-and-clarifications
309,US news,2022-06-27T20:01:13Z,US supreme court rules in favor of high school football coach over on-field prayers – as it happened,https://www.theguardian.com/us-news/live/2022/jun/27/biden-roe-v-wade-supreme-court-decisions-midterms-live-latest
199,Australia news,2022-06-26T20:57:45Z,"Morning mail: fury over US supreme court ruling, census data due, mystery nightclub deaths",https://www.theguardian.com/australia-news/2022/jun/27/morning-mail-fury-over-us-supreme-court-ruling-census-data-due-mystery-nightclub-deaths
137,Opinion,2022-07-02T08:00:40Z,I reject the US abortion ruling. I vow to defend the sovereignty of women’s bodies | V (formerly Eve Ensler),https://www.theguardian.com/us-news/2022/jul/02/multitudes-us-decision-abortion-supreme-court-women-revolt-questions
24,US news,2022-08-02T19:00:49Z,Justice department sues Idaho over state’s near-total abortion ban,https://www.theguardian.com/us-news/2022/aug/02/idaho-abortion-ban-justice-department-sues
399,Politics,2022-09-06T18:32:51Z,Thérèse Coffey: convivial pragmatist inherits health service in crisis,https://www.theguardian.com/politics/2022/sep/06/therese-coffey-convivial-pragmatist-inherits-health-service-in-crisis
443,World news,2022-09-06T10:31:47Z,Brazil braces for turbulence on eve of Bolsonaro’s independence day rallies,https://www.theguardian.com/world/2022/sep/06/brazil-bolsonaro-independence-day-rallies
184,Opinion,2022-06-26T05:30:34Z,The Observer view on Donald Trump’s influence on Roe v Wade ruling | Observer editorial,https://www.theguardian.com/commentisfree/2022/jun/26/observer-view-donald-trump-influence-roe-v-wade-abortion-ban
205,World news,2022-08-17T08:00:10Z,"How private is your period-tracking app? Not very, study reveals",https://www.theguardian.com/world/2022/aug/17/pregnancy-period-tracking-apps-privacy
134,Law,2022-06-24T23:25:59Z,‘Abortion returns to the states’: US attorneys general react to Roe v Wade ruling,https://www.theguardian.com/law/2022/jun/24/us-attorneys-general-react-supreme-court-ruling
299,From the Observer,2022-07-03T05:00:05Z,We desperately need more hospital beds | Letters,https://www.theguardian.com/theobserver/commentisfree/2022/jul/03/letters-we-desperately-need-more-hospital-beds
116,US news,2022-06-27T10:00:10Z,California abortion clinics braced for out-of-state surge as bans kick in,https://www.theguardian.com/us-news/2022/jun/27/california-abortion-clinics-out-of-state-surge
212,Opinion,2022-07-25T10:23:33Z,"If you have a miscarriage in Republican America, your health is now at risk | Moira Donegan",https://www.theguardian.com/commentisfree/2022/jul/25/abortion-republicans-anti-choice-women-health-risk
576,Australia news,2022-07-27T17:30:27Z,"Australian parliament 101: your questions about key words and processes, answered",https://www.theguardian.com/australia-news/2022/jul/28/australian-parliament-101-your-questions-about-key-words-and-processes-answered
594,US news,2022-08-04T20:02:23Z,Hungary’s far-right PM Viktor Orbán speaks at CPAC summit – as it happened,https://www.theguardian.com/us-news/live/2022/aug/04/senate-sinema-climate-inflation-reduction-biden-democrats
549,Music,2022-08-02T14:30:35Z,‘Un-American girl’: how Beyoncé uses the power of pleasure to transcend a country on fire,https://www.theguardian.com/music/2022/aug/02/un-american-girl-how-beyonce-uses-the-power-of-pleasure-to-transcend-a-country-on-fire
463,World news,2022-08-06T19:00:22Z,Can Jacinda Ardern turn popularity abroad into domestic success before it’s too late? | Henry Cooke,https://www.theguardian.com/world/2022/aug/07/can-jacinda-ardern-turn-her-popularity-abroad-into-domestic-success-before-its-too-late
231,US news,2022-09-07T12:04:37Z,"Massachusetts set to elect first female, gay governor over Trumpist opponent",https://www.theguardian.com/us-news/2022/sep/07/maura-healey-woman-gay-massachusetts-governor-geoff-diehl-donald-trump
